REFERENCE,LOCATION,APP TYPE,APP TYPE DECODE,VALIDATION DATE,PROPOSAL,RECOMMENDATION,RECOMMENDATION DECODE,DATEDECISS,DEVELOPMENT TYPE,DEVELOPMENT TYPE DECODE,WARD,WARD DECODE,KEYVAL,Postcode
12/61301/ADV,Coral 35 - 37 Church Street Eccles  M30 0BJ,ADV,Advert Application,04/01/2012 00:00,Display of one externally illuminated fascia sign and one internally illuminated projecting sign,PER,Approve,10/02/2012 00:00,Q22,Advertisements,EC,Eccles,LXDX2FNP00300,M30 0BJ
12/61324/ADV,11 Church Street Eccles M30 0DF,ADV,Advert Application,11/01/2012 00:00,Display of one externally illuminated fascia sign (re-sub of 11/60894/ADV),WDN,Application Withdrawn,16/01/2012 00:00,Q22,Advertisements,EC,Eccles,LXQBUYNP06300,M30 0DF
12/61306/ADV,Pier 8 The Quays Salford M50 3AZ,ADV,Advert Application,11/01/2012 00:00,Display of three internally illuminated fascia signs and eleven fabric banner signs,PER,Approve,17/02/2012 00:00,Q22,Advertisements,OR,Ordsall,LXKOY4NP5Y000,M50 3UB
12/61317/ADV,718 Bolton Road Pendlebury Swinton M27 6EW,ADV,Advert Application,12/01/2012 00:00,Display of one externally illuminated fascia sign,PER,Approve,17/02/2012 00:00,Q22,Advertisements,SN,Swinton North,LXOVK8NP00300,M27 6EW
12/61316/ADV,1 Barton Lane Eccles M30 0DD,ADV,Advert Application,12/01/2012 00:00,Display of one internally illuminated hanging sign,PER,Approve,24/02/2012 00:00,Q22,Advertisements,BA,Barton,LXOV2WNP06300,M30 0DD
12/61381/ADV,WM Morrisons Supermarket Plc 11 Trafford Road Salford M5 3FE,ADV,Advert Application,27/01/2012 00:00,Display of three internally illuminated fascia signs,PER,Approve,08/03/2012 00:00,Q22,Advertisements,OR,Ordsall,LYG692NP5Y000,M5  3SS
12/61389/ADV,Radclyffe Park Phoebe Street Salford M5 3PH,ADV,Advert Application,30/01/2012 00:00,Display of 7 internally illuminated advertisements and 9 non-illuminated advertisements,PER,Approve,08/03/2012 00:00,Q22,Advertisements,OR,Ordsall,LYI0XWNP5Y000,M5  3GN
12/61397/ADV,"Sites Surrounding Salford Innovation Forum At The Junction Of Broughton Road East And Frederick Road, Leslie Hough Way And Frederick Road And Winders Way And Frederick Road Salford M6 6FP",ADV,Advert Application,31/01/2012 00:00,Display of 4 free-standing non-illuminated signs,PER,Approve,26/03/2012 00:00,Q22,Advertisements,IW,Irwell Riverside,LYNKY6NP5Y000,M6  6FP
12/61359/ADV,The Stumble Inn 212 Cleggs Lane Little Hulton M38 9RQ,ADV,Advert Application,02/02/2012 00:00,"Display of one externally illuminated fascia sign, one projecting box sign, one pole mounted sign and six vinyl panels.",PER,Approve,08/03/2012 00:00,Q22,Advertisements,WN,Walkden North,LYAR1GNP00300,M38 9RQ
12/61341/ADV,Westwood House Suite 3A Greenwood Business Centre Regent Road Salford M5 4QH,ADV,Advert Application,03/02/2012 00:00,Display of one non illuminated sign,PER,Approve,22/03/2012 00:00,Q22,Advertisements,OR,Ordsall,LY529BNP5Y000,M5  4QH
12/61398/ADV,BOI Trading  257 Ordsall Lane Salford M5 3WH,ADV,Advert Application,06/02/2012 00:00,Display of one non-illuminated fascia sign,PER,Approve,19/03/2012 00:00,Q22,Advertisements,OR,Ordsall,LYPFKVNP5Y000,M5  3WH
12/61419/ADV,293 Bury New Road Salford M7 2YN,ADV,Advert Application,07/02/2012 00:00,Display of one internally illuminated entrance gate advertisement,PER,Approve,29/02/2012 00:00,Q22,Advertisements,BR,Broughton,LZ125GNP00300,M7  2YN
12/61432/ADV,17 Church Street Eccles M30 0DF,ADV,Advert Application,13/02/2012 00:00,Display of one externally illuminated fascia sign,PER,Approve,05/04/2012 00:00,Q22,Advertisements,EC,Eccles,LZC1K7NP00B00,M30 0DF
12/61437/ADV,The Mark Addy Stanley Street Salford M3 5EJ,ADV,Advert Application,13/02/2012 00:00,Display of three non-illuminated banners attached to poles,PER,Approve,15/06/2012 00:00,Q22,Advertisements,OR,Ordsall,LZE1B3NP06300,M3  5EJ
12/61436/ADV,"Land Bounded By Pendleton Way, Fitzwarren Street And Seedley Road Salford M6 5FW",ADV,Advert Application,15/02/2012 00:00,Display of non illuminated hoarding signs surrounding the site,PER,Approve,11/04/2012 00:00,Q22,Advertisements,LG,Langworthy,LZDL5JNP00B00,M6  5JG
12/61474/ADV,Roundabout At Eastern End Of M602 Regent Road Salford,ADV,Advert Application,21/02/2012 00:00,Display of ten flag pole advertisements,PER,Approve,11/04/2012 00:00,Q22,Advertisements,OR,Ordsall,LZWIDRNP00300,M5  4DG
12/61471/ADV,19 Trafford Road Salford M5 3AW,ADV,Advert Application,27/02/2012 00:00,"Display of six internally illuminated fascia sign, one internally illuminated hanging sign and one internally illuminated totem pole advertisement",PER,Approve,11/04/2012 00:00,Q22,Advertisements,OR,Ordsall,LZW0XRNP5Y000,M5  3AW
12/61477/ADV,API Holographics Ltd Astor Road Salford M50 1BB,ADV,Advert Application,05/03/2012 00:00,Display of one non illuminated fascia sign,PER,Approve,30/04/2012 00:00,Q22,Advertisements,SW,Weaste  And Seedley,LZXVMKNP5Y000,M50 1BB
12/61511/ADV,Gateway Building 5 Anchorage Quay Salford M50 3XE,ADV,Advert Application,08/03/2012 00:00,Display of one internally illuminated totem pole,PER,Approve,02/05/2012 00:00,Q22,Advertisements,OR,Ordsall,M0I8X4NP5Y000,M50 3XE
12/61496/ADV,Aldine House New Bailey Street Salford M3 5EU,ADV,Advert Application,08/03/2012 00:00,Display of two internally illuminated signs and one non illuminated sign,PER,Approve,02/05/2012 00:00,Q22,Advertisements,OR,Ordsall,M08ZKRNP5Y000,M3  5EU
12/61553/ADV,Navigation House 1 Furness Quay Salford M50 3XZ,ADV,Advert Application,19/03/2012 00:00,"Display of four internally illuminated fascia signs, one non-illuminated fascia sign, one externally illuminated projecting sign and fourteen non-illuminated signs",PER,Approve,27/06/2012 00:00,Q22,Advertisements,OR,Ordsall,M10RLMNP5Y000,M50 3XZ
12/61551/ADV,115 Mather Way Salford M6 5EH,ADV,Advert Application,19/03/2012 00:00,"Display of three internally illuminated fascia signs, one externally illuminated sign and two internally illuminated ATM signs",PER,Approve,27/06/2012 00:00,Q22,Advertisements,LG,Langworthy,M10RKYNP5Y000,M6  5EH
12/61550/ADV,82 Church Street Eccles M30 0DA,ADV,Advert Application,19/03/2012 00:00,"Display of one internally illuminated fascia sign, one externally illuminated projecting sign and two internally illuminated ATM signs",PER,Approve,08/05/2012 00:00,Q22,Advertisements,EC,Eccles,M10RKPNP5Y000,M30 0DA
12/61554/ADV,151 Chorley Road Swinton M27 4AE,ADV,Advert Application,19/03/2012 00:00,"Display of two non-illuminated fascia signs, two internally illuminated fascia signs, two externally illuminated projecting signs and two ATM header panels",PER,Approve,09/05/2012 00:00,Q22,Advertisements,SS,Swinton South,M10RLXNP5Y000,M27 4AE
12/61555/ADV,1 Bridgewater Road Worsley M28 3JE,ADV,Advert Application,19/03/2012 00:00,"Display of three internally illuminated fascia signs, two externally illuminated projecting signs and one ATM header and panel",PER,Approve,09/05/2012 00:00,Q22,Advertisements,WS,Walkden South,M10RM7NP5Y000,M28 3JE
12/61518/ADV,400 Ordsall Lane Salford M5 3BU,ADV,Advert Application,28/03/2012 00:00,Display of three internally illuminated fascia signs and one internally illuminated hanging sign,PER,Approve,20/07/2012 00:00,Q22,Advertisements,OR,Ordsall,M0K3KENP5Y000,M5  3DR
12/61602/ADV,15-21 Bolton Road Worsley M28 3AX,ADV,Advert Application,28/03/2012 00:00,Display of four internally illuminated fascia signs,PER,Approve,23/05/2012 00:00,Q22,Advertisements,WN,Walkden North,M1MZ89NP00B00,M28 3AX
12/61643/ADV,The Stay Inn 55 Blackfriars Road Salford M3 7DB,ADV,Advert Application,10/04/2012 00:00,Display of one internally illuminated totem pole,PER,Approve,13/07/2012 00:00,Q22,Advertisements,IW,Irwell Riverside,M2063UNP00B00,M3  7DB
12/61657/ADV,722 Bolton Road Pendlebury M27 6EW,ADV,Advert Application,11/04/2012 00:00,Display of an externally illuminated fascia sign,PER,Approve,28/05/2012 00:00,Q22,Advertisements,SN,Swinton North,M2AZI0NP5Y000,M27 6EW
12/61669/ADV,19 Church Road Eccles M30 0DL,ADV,Advert Application,13/04/2012 00:00,Display of one externally illuminated fascia sign,PER,Approve,28/05/2012 00:00,Q22,Advertisements,EC,Eccles,M2EWEDNP5Y000,M30 0DL
12/61682/ADV,Ellesmere Retail Park Bolton Road Worsley M28 3BT,ADV,Advert Application,19/04/2012 00:00,Display of 13 No. externally illuminated advert hoardings,PER,Approve,08/06/2012 00:00,Q22,Advertisements,WN,Walkden North,M2NY5KNP5Y000,M28 3ZD
12/61690/ADV,Southwood House Greenwood Business Centre Regent Road Salford,ADV,Advert Application,23/04/2012 00:00,Display of 6 non-illuminated signs,PER,Approve,27/07/2012 00:00,Q22,Advertisements,OR,Ordsall,M2PSSGNP5Y000,M5  4QH
12/61720/ADV,Shaw Trust 92 Phoebe Street Salford M5 3PH,ADV,Advert Application,04/05/2012 00:00,Display of two non-illuminated fascia signs,PER,Approve,08/06/2012 00:00,Q22,Advertisements,OR,Ordsall,M3C0SPNP5Y000,M5  3GN
12/61747/ADV,Type High Ltd  606 Liverpool Road Irlam M44 5AA,ADV,Advert Application,05/05/2012 00:00,Display of one externally illuminated fascia sign,PER,Approve,15/06/2012 00:00,Q22,Advertisements,CD,Cadishead,M3JFH7NP5Y016,M44 5AA
12/61745/ADV,506 Liverpool Road Eccles M30 7HZ,ADV,Advert Application,05/05/2012 00:00,Display of one externally illuminated fascia sign,PER,Approve,15/06/2012 00:00,Q22,Advertisements,WI,Winton,M3JFH3NP5Y000,M30 7HZ
12/61751/ADV,Holy Rood Church Moorside Road Swinton M27 0HJ,ADV,Advert Application,08/05/2012 00:00,Display of one notice board,PER,Approve,26/06/2012 00:00,Q22,Advertisements,WO,Worsley,M3R7PWNP00B00,M27 0HJ
12/61350/ADV,76 Liverpool Street Salford M5 4LS,ADV,Advert Application,08/05/2012 00:00,Display of 1 No. internally illuminated fascia sign,PER,Approve,29/06/2012 00:00,Q22,Advertisements,OR,Ordsall,LY8XY5NP06300,M5  4LS
12/61779/ADV,Tesco Stores Ltd  Woodrow Way Irlam M44 6BL,ADV,Advert Application,17/05/2012 00:00,Display of three non illuminated fascia signs,PER,Approve,29/06/2012 00:00,Q22,Advertisements,CD,Cadishead,M43SSYNP5Y000,M44 6BL
12/61782/ADV,Irlam Swimming Pool  Liverpool Road Irlam M44 6BR,ADV,Advert Application,21/05/2012 00:00,Display of one internally illuminated hanging sign and one vinyl banner sign,PER,Approve,11/07/2012 00:00,Q22,Advertisements,CD,Cadishead,M45NGRNP5Y000,M44 6BR
12/61825/ADV,Chapel Walks Chapel Street Salford,ADV,Advert Application,28/05/2012 00:00,Display of one internally illuminated fascia sign,PER,Approve,03/07/2012 00:00,Q22,Advertisements,OR,Ordsall,M4MBI3NP5Y000,M3  5DW
12/61822/ADV,Post Office 63 Church Street Eccles M30 0NS,ADV,Advert Application,28/05/2012 00:00,Display of four non illuminated fascia signs,PER,Approve,02/07/2012 00:00,Q22,Advertisements,BA,Barton,M4KGT8NP5Y000,M30 0LH
12/61794/ADV,4 Capital Quay Salford M50 3WL,ADV,Advert Application,30/05/2012 00:00,"Display of three externally illuminated signs, two externally illuminated fascia signs, six non illuminated signs and an externally illuminated totem pole sign",PER,Approve,11/07/2012 00:00,Q22,Advertisements,OR,Ordsall,M4D52SNP00B00,M50 3WL
12/61847/ADV,Unit 30 Hulton District Centre Worsley M28 0AU,ADV,Advert Application,06/06/2012 00:00,Display of one internally illuminated fascia sign,PER,Approve,30/07/2012 00:00,Q22,Advertisements,LH,Little Hulton,M4VKTBNP5Y000,M28 0AX
12/61854/ADV,Central Reservation On Trafford Road Junction Of Ordsall Lane Salford M5 3AW,ADV,Advert Application,12/06/2012 00:00,Display of one internally illuminated double sided advert hoarding,PER,Approve,30/07/2012 00:00,Q22,Advertisements,OR,Ordsall,M4ZA6ENP5Y000,M5  3DR
12/61895/ADV,2 Church Street Eccles M30 0DF,ADV,Advert Application,14/06/2012 00:00,Display of one non-illuminated fascia sign and one non-illuminated hanging sign,PER,Approve,30/07/2012 00:00,Q22,Advertisements,EC,Eccles,M5LI60NP5Y000,M30 0DF
12/61927/ADV,The Print Shop  23 Bolton Road Worsley M28 3AX,ADV,Advert Application,21/06/2012 00:00,Display of one internally illuminated fascia sign,PER,Approve,27/07/2012 00:00,Q22,Advertisements,WN,Walkden North,M5YGU4NP5Y000,M28 3AX
12/61893/ADV,Frankie & Benny's  3 Capital Quay Salford M50 3WL,ADV,Advert Application,21/06/2012 00:00,Display of 3 non-illuminated pole mounted signs and 1 non illuminated freestanding sign,PER,Approve,06/08/2012 00:00,Q22,Advertisements,OR,Ordsall,M5LI5ENP5Y00G,M50 3WL
12/61943/ADV,559 Liverpool Road Irlam M44 5BE,ADV,Advert Application,22/06/2012 00:00,Display of externally illuminated fascia sign,PER,Approve,06/08/2012 00:00,Q22,Advertisements,CD,Cadishead,M60BO1NP5Y000,M44 5BE
12/61907/ADV,"Pizza Express, G38 The Lowry Designer Outlet  The Quays Salford M50 3AG",ADV,Advert Application,28/06/2012 00:00,"Display of three internally illuminated fascia signs, two internally illuminated hanging signs, five internally illuminated other signs and two non illuminated other signs",PER,Approve,06/08/2012 00:00,Q22,Advertisements,OR,Ordsall,M5R25ANP5Y000,M50 3AZ
12/61973/ADV,522 Liverpool Road Eccles M30 7JA,ADV,Advert Application,28/06/2012 00:00,Display of one externally illuminated fascia sign,PER,Approve,06/08/2012 00:00,Q18,Minor Others,WI,Winton,M6BFHCNP5Y000,M30 7JA
12/61976/ADV,Irlam News & Wine  675 Liverpool Road Irlam M44 5GQ,ADV,Advert Application,28/06/2012 00:00,Display of externally illuminated fascia sign,PER,Approve,06/08/2012 00:00,Q18,Minor Others,CD,Cadishead,M6BFHQNP5Y000,M44 5GQ
12/61987/ADV,Pao Sing Food Centre  677 Liverpool Road Irlam M44 5GQ,ADV,Advert Application,30/06/2012 00:00,Display of an externally illuminated fascia sign,PER,Approve,06/08/2012 00:00,Q22,Advertisements,CD,Cadishead,M6F4TBNP5Y000,M44 5GQ
12/61790/ADV,N G Bailey & Co Ltd  321 Ordsall Lane Salford M5 3HP,ADV,Advert Application,30/06/2012 00:00,Display of one non illuminated fascia sign,PER,Approve,30/07/2012 00:00,Q22,Advertisements,OR,Ordsall,M49CT9NP5Y000,M5  3HP
12/62008/ADV,2 Bloom Street Salford M3 6DF,ADV,Advert Application,02/07/2012 00:00,Display of externally illuminated fascia sign,PER,Approve,06/08/2012 00:00,Q22,Advertisements,OR,Ordsall,M6L29QNP06H00,M3  6DF
12/61990/ADV,Rogers Chippy  546 Liverpool Road Eccles M30 7JA,ADV,Advert Application,02/07/2012 00:00,Display of externally illuminated fascia sign,PER,Approve,06/08/2012 00:00,Q22,Advertisements,WI,Winton,M6F4TLNP5Y000,M30 7JA
12/61996/ADV,548 Liverpool Road Eccles M30 7JA,ADV,Advert Application,03/07/2012 00:00,Display of externally illuminated fascia sign,PER,Approve,06/08/2012 00:00,Q22,Advertisements,WI,Winton,M6KOTINP5Y000,M30 7JA
12/61998/ADV,524 Liverpool Road Eccles M30 7JA,ADV,Advert Application,03/07/2012 00:00,Display of externally illuminated fascia sign,PER,Approve,13/08/2012 00:00,Q22,Advertisements,WI,Winton,M6KOTUNP5Y000,M30 7JA
12/62002/ADV,561-563 Liverpool Road Irlam M44 5BE,ADV,Advert Application,03/07/2012 00:00,Display of externally illuminated fascia sign,PER,Approve,13/08/2012 00:00,Q22,Advertisements,CD,Cadishead,M6KOUINP5Y000,M44 5BE
12/62013/ADV,58 Chorley Road Swinton M27 5AD,ADV,Advert Application,04/07/2012 00:00,Display of non illuminated fascia sign,PER,Approve,13/08/2012 00:00,Q22,Advertisements,SS,Swinton South,M6MJJENP5Y000,M27 5AD
12/61980/ADV,Employment Law Advisory Services Ltd Charles House Albert Street Eccles Manchester M30 0LJ,ADV,Advert Application,04/07/2012 00:00,Display of two internally illuminated signs,PER,Approve,13/08/2012 00:00,Q22,Advertisements,EC,Eccles,M6DA5BNP5Y000,M30 0PW
12/62020/ADV,Former Radclyffe Community Primary School Phoebe Street Salford M5 3PH,ADV,Advert Application,04/07/2012 00:00,Display of ten non illuminated fascia signs,PER,Approve,06/08/2012 00:00,Q22,Advertisements,OR,Ordsall,M6N4EZNP06H00,M5  3GN
12/62006/ADV,Adamson House 2 Centenary Way Salford M5 3DL,ADV,Advert Application,09/07/2012 00:00,"Display of one externally illuminated fascia sign",PER,Approve,06/08/2012 00:00,Q22,Advertisements,OR,Ordsall,M6L06KNP00B00,M5  3DL
12/62034/ADV,6 Standfield Centre Worsley M28 1FB,ADV,Advert Application,10/07/2012 00:00,Display of three internally illuminated fascia signs and four non-illuminated other signs,PER,Approve,15/08/2012 00:00,Q22,Advertisements,BE,Boothstown And Ellenbrook,M6S3HNNP5Y000,M28 1FB
12/62035/ADV,Tesco Stores Ltd  Woodrow Way Irlam M44 6BL,ADV,Advert Application,11/07/2012 00:00,Display of three non illuminated signs,PER,Approve,15/08/2012 00:00,Q22,Advertisements,CD,Cadishead,M6S3HWNP5Y000,M44 6BL
12/62041/ADV,Land Adjacent To 148 Church Street And Corner Of  Shuttle Street Eccles M30 0EW,ADV,Advert Application,18/07/2012 00:00,Display of one externally illuminated hoarding advertisement,PER,Approve,07/09/2012 00:00,Q22,Advertisements,EC,Eccles,M6XNH9NP5Y000,M30 0LS
12/62044/ADV,14 Ellenbrook Road Worsley M28 1FZ,ADV,Advert Application,20/07/2012 00:00,"Display of two fascia signs, two projecting signs, 2 poster boards and the retention of 6 poster boards",PER,Approve,14/09/2012 00:00,Q22,Advertisements,BE,Boothstown And Ellenbrook,M6Y69ANP06H00,M28 1FZ
12/62049/ADV,14 Ellenbrook Road Worsley M28 1FZ,ADV,Advert Application,20/07/2012 00:00,Display of one freestanding non illuminated totem signage,PER,Approve,07/09/2012 00:00,Q22,Advertisements,BE,Boothstown And Ellenbrook,M6ZWECNP06H00,M28 1FZ
12/62070/ADV,151 - 153 Eccles New Road Salford M5 4QQ,ADV,Advert Application,26/07/2012 00:00,Display of one internally illuminated ATM sign,PER,Approve,19/09/2012 00:00,Q22,Advertisements,OR,Ordsall,M7CGT4NP5Y000,M5  4QQ
12/62102/ADV,Corner Of Chapel Street And Blackfriars Street  Salford M3 7AA,ADV,Advert Application,27/07/2012 00:00,"Retention of one externally illuminated hoarding sign and two internally illuminated hoarding signs (re-sub of 11/60805/ADV)",PER,Approve,17/09/2012 00:00,Q22,Advertisements,OR,Ordsall,M7TJGZNP06300,M3  5AL
12/62124/ADV,41-43 Bolton Road Worsley M28 3AY,ADV,Advert Application,31/07/2012 00:00,Display of three internally illuminated fascia signs and one hanging sign,PER,Approve,19/09/2012 00:00,Q22,Advertisements,WN,Walkden North,M80JI5NP5Y000,M28 3AY
12/62129/ADV,535A-D Liverpool Road Irlam M44 6ZS,ADV,Advert Application,02/08/2012 00:00,Display of four externally illuminated fascia signs,PER,Approve,19/09/2012 00:00,Q22,Advertisements,CD,Cadishead,M848TTNP5Y000,M44 6ZS
12/62160/ADV,23 The Parade Swinton M27 4BH,ADV,Advert Application,10/08/2012 00:00,"Display of one internally illuminated fascia sign, one internally illuminated hanging sign and one other sign",PER,Approve,28/09/2012 00:00,Q22,Advertisements,SS,Swinton South,M8H7IRNP5Y000,M27 4BH
12/62022/ADV,New Tesco Store And Petrol Station Pendleton Way Salford,ADV,Advert Application,10/08/2012 00:00,Various illuminated and non-illuminated signs to Tesco store,PER,Approve,05/10/2012 00:00,Q22,Advertisements,LG,Langworthy,M6OE6GNP5Y000,M6  5JG
12/62184/ADV,Bus Stop Adjacent To  229A Manchester Road Swinton M27 4TT,ADV,Advert Application,14/08/2012 00:00,Display of one internally illuminated double sided advert hoarding,PER,Approve,01/10/2012 00:00,Q22,Advertisements,SS,Swinton South,M8QGUBNP5Y000,M27 4TT
12/62172/ADV,Salford Gallery And Museum Crescent Salford M5 4WU,ADV,Advert Application,15/08/2012 00:00,Display of three vinyl banners and two vinyl signs,WDN,Application Withdrawn,03/10/2012 00:00,Q22,Advertisements,IW,Irwell Riverside,M8KWSVNP5Y000,M5  4WU
12/62211/ADV,Bus Shelter Bolton Road Salford,ADV,Advert Application,17/08/2012 00:00,Display of one internally illuminated double sided advert hoarding,PER,Approve,12/10/2012 00:00,Q22,Advertisements,CL,Claremont,M8W0T9NP5Y000,M6  7NW
12/62216/ADV,API Holographics Ltd Astor Road Salford M50 1BB,ADV,Advert Application,18/08/2012 00:00,Display of one non illuminated fascia sign Re Sub of 12/61477/ADV,PER,Approve,12/10/2012 00:00,Q22,Advertisements,SW,Weaste  And Seedley,M8XVK0NP5Y000,M50 1BB
12/62221/ADV,105A Cromwell Road Eccles M30 0GX,ADV,Advert Application,21/08/2012 00:00,Display of two non illuminated fascia signs,PER,Approve,22/10/2012 00:00,Q22,Advertisements,BA,Barton,M91KTENP5Y000,M30 0RB
12/62067/ADV,18-19 King Edwards Buildings Bury Old Road Salford M7 4QJ,ADV,Advert Application,23/08/2012 00:00,Display of one internally illuminated fascia sign,PER,Approve,12/10/2012 00:00,Q22,Advertisements,KR,Kersal,M7AM5GNP5Y000,M7  4QJ
12/62243/ADV,1A Regent Street Eccles M30 0BP,ADV,Advert Application,24/08/2012 00:00,Display of one externally illuminated fascia sign,PER,Approve,12/10/2012 00:00,Q22,Advertisements,EC,Eccles,M98ZIGNP5Y000,M30 0BP
12/62230/ADV,Halifax Plc  92-94 Church Street Eccles M30 0DA,ADV,Advert Application,24/08/2012 00:00,Display of one fascia sign and one hanging sign internally illuminated and one internally illuminated ATM collar sign,PER,Approve,12/10/2012 00:00,Q22,Advertisements,EC,Eccles,M974TINP5Y000,M30 0DA
12/62255/ADV,38 Chorley Road Swinton M27 5AF,ADV,Advert Application,31/08/2012 00:00,Display of one externally illuminated fascia sign,PER,Approve,08/10/2012 00:00,Q22,Advertisements,SS,Swinton South,M9LY53NP5Y000,M27 5AF
12/62191/ADV,Fairbank House  Comus Street Salford M5 3BQ,ADV,Advert Application,31/08/2012 00:00,Display of one non-illuminated fascia sign,PER,Approve,15/10/2012 00:00,Q22,Advertisements,OR,Ordsall,M8U654NP5Y000,M5  3BQ
12/62290/ADV,554 - 556 Bolton Road Pendlebury Swinton M27 4DL,ADV,Advert Application,07/09/2012 00:00,Display of one externally illuminated fascia sign,PER,Approve,24/10/2012 00:00,Q22,Advertisements,PE,Pendlebury,M9YWTYNP5Y000,M27 4DL
12/62288/ADV,719 Bolton Road Swinton M27 8FL,ADV,Advert Application,07/09/2012 00:00,Display of one externally illuminated fascia sign,PER,Approve,15/10/2012 00:00,Q22,Advertisements,PE,Pendlebury,M9YWTPNP5Y000,M27 8FL
12/62298/ADV,24 - 24A Church Street Eccles M30 0DF,ADV,Advert Application,08/09/2012 00:00,Display of one externally illuminated fascia sign,PER,Approve,15/10/2012 00:00,Q22,Advertisements,EC,Eccles,MA0RHSNP5Y000,M30 0DF
12/62292/ADV,Clinton Cards Plc  36-38 The Parade Swinton M27 4BH,ADV,Advert Application,11/09/2012 00:00,Display of one internally illuminated fascia sign,PER,Approve,15/10/2012 00:00,Q22,Advertisements,SS,Swinton South,M9YWUGNP5Y000,M27 4BH
12/62307/ADV,Lloyds TSB Bank Plc  62 Church Street Eccles M30 0DA,ADV,Advert Application,17/09/2012 00:00,"Display of two internally illuminated fascia signs, one internally illuminated hanging sign and two internally illuminated ATM collar signs",PER,Approve,29/10/2012 00:00,Q22,Advertisements,EC,Eccles,MABVJNNP5Y000,M30 0DA
12/62339/ADV,Lidl 2 Woodrow Way Irlam M44 6NN,ADV,Advert Application,24/09/2012 00:00,Display of one non-illuminated advertisement hoarding,PER,Approve,12/11/2012 00:00,Q22,Advertisements,CD,Cadishead,MAQOT9NP5Y000,M44 6BA
12/62310/ADV,575A Liverpool Road Irlam M44 5BE,ADV,Advert Application,25/09/2012 00:00,Display of two externally illuminated fascia signs,PER,Approve,14/11/2012 00:00,Q22,Advertisements,CD,Cadishead,MABVK0NP5Y000,M44 5BE
12/62312/ADV,Aras Convenience Super Store  562 Liverpool Road Irlam M44 6ZA,ADV,Advert Application,25/09/2012 00:00,Display of one internally illuminated fascia sign,PER,Approve,14/11/2012 00:00,Q22,Advertisements,CD,Cadishead,MABVK7NP5Y000,M44 6ZA
12/62352/ADV,Broughton Hub  50 Rigby Street Salford M7 4BQ,ADV,Advert Application,26/09/2012 00:00,Display of two non-illuminated fascia signs and three other signs,PER,Approve,14/11/2012 00:00,Q22,Advertisements,BR,Broughton,MAY3HZNP5Y000,M7  4BQ
12/62357/ADV,Natwest  313-315 Bolton Road Salford M6 7LR,ADV,Advert Application,02/10/2012 00:00,Display of one internally illuminated ATM surround sign,PER,Approve,02/11/2012 00:00,Q22,Advertisements,CL,Claremont,MB1SSUNP5Y000,M6  7LR
12/62355/ADV,Central Reservation On Trafford Road Junction Of Ordsall Lane Salford M5 3AW,ADV,Advert Application,08/10/2012 00:00,Display of one internally illuminated double sided advert hoarding,PER,Approve,09/11/2012 00:00,Q22,Advertisements,OR,Ordsall,MAYIG9NP06300,M5  3DR
12/62400/ADV,6 Standfield Centre Worsley M28 1FB,ADV,Advert Application,10/10/2012 00:00,Display of one totem pole and two non illuminated signs,PER,Approve,18/12/2012 00:00,Q22,Advertisements,BE,Boothstown And Ellenbrook,MBM65CNP5Y000,M28 1FB
12/62424/ADV,42 Chorley Road Swinton M27 5AF,ADV,Advert Application,13/10/2012 00:00,Display of one externally illuminated fascia sign,PER,Approve,05/12/2012 00:00,Q22,Advertisements,SS,Swinton South,MBTL1ENP5Y000,M27 5AF
12/62415/ADV,6 King Edwards Buildings Bury Old Road Salford M7 4QJ,ADV,Advert Application,16/10/2012 00:00,Display of one internally illuminated ATM collar sign,PER,Approve,03/12/2012 00:00,Q22,Advertisements,KR,Kersal,MBRQ5QNP5Y000,M7  4QJ
12/62450/ADV,717 Bolton Road Swinton M27 8FL,ADV,Advert Application,19/10/2012 00:00,Display of one externally illuminated fascia sign,PER,Approve,03/12/2012 00:00,Q22,Advertisements,PE,Pendlebury,MC4OTBNP5Y000,M27 8FL
12/62461/ADV,Newtown Post Office  721 Bolton Road Swinton M27 8FL,ADV,Advert Application,23/10/2012 00:00,Display of one externally illuminated fascia sign,PER,Approve,03/12/2012 00:00,Q22,Advertisements,PE,Pendlebury,MCC3HBNP5Y000,M27 8FL
12/62495/ADV,St Ambrose Barlow RC School   Manchester Road  Swinton Wardley  Lancashire M27 9QL,ADV,Advert Application,01/11/2012 00:00,Display of three non-illuminated external signs,PER,Approve,21/12/2012 00:00,Q22,Advertisements,SN,Swinton North,MCQZLWNP5Y000,M27 9QP
12/62529/ADV,McDonalds Restaurants Ltd  447 Bolton Road Swinton Pendlebury M27 8BB,ADV,Advert Application,08/11/2012 00:00,Display of 9 internally illuminated signs and 1 other sign,PER,Approve,21/12/2012 00:00,Q22,Advertisements,PE,Pendlebury,MD5SYCNP5Y000,M27 8BB
12/62536/ADV,Ellesmere Retail Park Bolton Road Worsley M28 3BT,ADV,Advert Application,12/11/2012 00:00,Display of one internally illuminated fascia sign,PER,Approve,07/01/2013 00:00,Q22,Advertisements,WN,Walkden North,MD7NMDNP5Y000,M28 3ZD
