REFERENCE,LOCATION,APP TYPE,APP TYPE DECODE,VALIDATION DATE,PROPOSAL,RECOMMENDATION,RECOMMENDATION DECODE,DATEDECISS,DEVELOPMENT TYPE,DEVELOPMENT TYPE DECODE,WARD,WARD DECODE,KEYVAL,Postcode
13/63531/DISCON,"Land To South Of Stanley Street And West Of Irwell Street, Salford",DISCON,Formal Discharge of Condition,10/07/2013 00:00,Request for confirmation of compliance of condition 6 (flood mitigation) attached to planning permission 13/63136/FUL,DIS,Discharge of Condition,21/08/2013 00:00,DISCON,Discharge of Condition,OR,Ordsall,MPTOH3NP06300,M3  5EN
13/63511/DISCON,Land Formerly Stowell Spire Eccles New Road Salford,DISCON,Formal Discharge of Condition,11/07/2013 00:00,Request for confirmation of compliance of condition 12 (Affordable housing) attached to planning permission 11/61060/FUL,DIS,Discharge of Condition,08/08/2013 00:00,DISCON,Discharge of Condition,OR,Ordsall,MPNQ72NP5Y000,M5  4SF
13/63512/DISCON,Former Stowell Spire Public House Howard Street Salford M5 2SA,DISCON,Formal Discharge of Condition,11/07/2013 00:00,Request for confirmation of compliance of condition 3 (preliminary risk assessment) attached to planning permission 07/55085/REM,NDIS,Not discharging,08/08/2013 00:00,DISCON,Discharge of Condition,OR,Ordsall,MPNQ75NP5Y000,M5  4RX
13/63553/DISCON,33 Grange Road Eccles M30 8JW,DISCON,Formal Discharge of Condition,12/07/2013 00:00,"Request for confimation of compliance of conditions 4 (flood risk), 5 (landscaping), 6 (tree protection), 7 (replacement planting), 8 (remedial strategy) attached to planning permission 10/59656/FUL",WDN,Application Withdrawn,25/09/2013 00:00,DISCON,Discharge of Condition,WI,Winton,MQ4HSHNP06300,M30 8JW
13/63557/DISCON,Wentworth High School  Wentworth Road Eccles M30 9BP,DISCON,Formal Discharge of Condition,19/07/2013 00:00,Request for confirmation of compliance of condition 3 (landscaping) attached to planning permission 13/63065/FUL,DIS,Discharge of Condition,25/09/2013 00:00,DISCON,Discharge of Condition,EC,Eccles,MQ68U5NP5Y000,M30 9BP
13/63573/DISCON,Ashworth And Wakefield Building Peel Park Campus University Of Salford Crescent Salford,DISCON,Formal Discharge of Condition,23/07/2013 00:00,Request for confirmation of compliance of condition 2 attached to planning permission 11/60336/FUL,PDIS,Part Discharge of Condition,26/11/2013 00:00,DISCON,Discharge of Condition,IW,Irwell Riverside,MQDNGPNP5Y000,M5  4RB
13/63588/DISCON,Wentworth High School Wentworth Road Eccles M30 9BP,DISCON,Formal Discharge of Condition,26/07/2013 00:00,Request for confirmation of compliance of condition 12 (Sports Pitch Design) attached to planning permission 13/63065/FUL,PDIS,Part Discharge of Condition,,DISCON,Discharge of Condition,EC,Eccles,MQJ7IZNP5Y000,M30 9BP
13/63606/DISCON,Land Off Moss Lane Worsley M28 3NN,DISCON,Formal Discharge of Condition,30/07/2013 00:00,Request for confirmation of compliance of condition 6 (external lighting) attached to planning permission 12/61290/REM,DIS,Discharge of Condition,,DISCON,Discharge of Condition,WN,Walkden North,MQSNATNP06300,M28 3NF
13/63586/DISCON,Cygnet House  111 Taylorson Street South Salford M5 3BL,DISCON,Formal Discharge of Condition,31/07/2013 00:00,Request for confirmation of compliance of condition 18 (Post Office Business) attached to planning permission 11/60843/OUT,PER,Approve,30/08/2013 00:00,DISCON,Discharge of Condition,OR,Ordsall,MQJ7GUNP5Y000,M5  3BL
13/63611/DISCON,Swinton Shopping Centre Swinton M27 4BY,DISCON,Formal Discharge of Condition,01/08/2013 00:00,Request for confirmation of compliance of conditions 3 (samples) 16 (Travel Plan) and 26 (landscaping) attached to planning permission 11/61169/FUL,PDIS,Part Discharge of Condition,21/08/2013 00:00,DISCON,Discharge of Condition,SS,Swinton South,MQUHFINP06300,M27 4BY
13/63626/DISCON,Salford City College City Campus Skill Centre Lissadel Street Salford M6 6AP,DISCON,Formal Discharge of Condition,06/08/2013 00:00,Request for confirmation of compliance of condition 2 (materials) attached to planning permission 13/63300/FUL,DIS,Discharge of Condition,20/09/2013 00:00,DISCON,Discharge of Condition,IW,Irwell Riverside,MR22I1NP00B00,M6  6AP
13/63662/DISCON,73 Chatsworth Road Land The Junction Of Chatsworth Road The Coppice Swinton,DISCON,Formal Discharge of Condition,10/08/2013 00:00,"Request for confirmation of compliance of conditions 2 (samples), 3 (contaminated land), 5 (TPO) and 6 (Cellweb surfacing) attached to planning permission 10/59208/FUL",PDIS,Part Discharge of Condition,06/09/2013 00:00,DISCON,Discharge of Condition,WO,Worsley,MRAZMANP5Y000,M28 2WS
13/63614/DISCON,Former Oasis Academy Playing Fields And Muliti Use Games Area Eccles Old Road Salford,DISCON,Formal Discharge of Condition,13/08/2013 00:00,Request for confirmation of compliance of condition 4 (drainage) attached to planning permission 12/62681/FUL,DIS,Discharge of Condition,27/09/2013 00:00,DISCON,Discharge of Condition,SW,Weaste  And Seedley,MQW64YNP5Y000,M6  8GG
13/63651/DISCON,"Land Bounded By Heywood Way, Market Way And Hankinson Way (to South Of Salford Shopping City)  Pendleton Salford",DISCON,Formal Discharge of Condition,14/08/2013 00:00,Request for confirmation of compliance of conditions 2 (samples) and 4 (drainage) attached to planning permission 13/63247/FUL,DIS,Discharge of Condition,20/11/2013 00:00,DISCON,Discharge of Condition,LG,Langworthy,MR94T1NP5Y000,M6  5JT
13/63695/DISCON,28 Singleton Road Salford M7 4WL,DISCON,Formal Discharge of Condition,16/08/2013 00:00,"Request for confirmation of compliance of conditions 3 (contam land), 4 (cycle bins/recycling areas), 5 (trees), 7 (works within dripline), 8 (lighting), 9 (surface water) 10 (samples) attached to planning permission 13/62917/FUL",PDIS,Part Discharge of Condition,,DISCON,Discharge of Condition,KR,Kersal,MRKHSTNP06300,M7  4JP
13/63746/DISCON,Burgess Farm Hilton Lane Worsley M28 3TL,DISCON,Formal Discharge of Condition,21/08/2013 00:00,Request for confirmation of compliance of condition 17 attached to planning permission 10/58745/OUTEIA,PDIS,Part Discharge of Condition,06/09/2013 00:00,DISCON,Discharge of Condition,WS,Walkden South,MS6O7ZNP00B00,M28 3TL
13/63767/DISCON,Land At Deans Field And Moorside Primary And High School Swinton,DISCON,Formal Discharge of Condition,22/08/2013 00:00,Request for confirmation of compliance of conditions 23 (Historic Buildings Surveys) attached to planning permission 11/60689/FUL,DIS,Discharge of Condition,19/02/2014 00:00,DISCON,Discharge of Condition,,,MSHQCDNP00B00,M30 7LU
13/63747/DISCON,St. Philips C of E School  Barrow Street Salford M3 5LF,DISCON,Formal Discharge of Condition,28/08/2013 00:00,Request for confirmation of compliance of conditions 4 ( Site investigation) And 6 ( Tree Replacement) attached to planning permission 13/63286/FUL,DIS,Discharge of Condition,09/10/2013 00:00,DISCON,Discharge of Condition,OR,Ordsall,MS8BH5NP5Y000,M3  5LF
13/63749/DISCON,33 Grange Road Eccles M30 8JW,DISCON,Formal Discharge of Condition,29/08/2013 00:00,"Request for confimation of compliance of conditions 3 (materials/samples), 4 (flood risk), 5 (landscaping), 6 (tree protection), 7 (replacement planting), 8 (remedial strategy) attached to planning permission 10/59656/FUL",PDIS,Part Discharge of Condition,17/12/2013 00:00,DISCON,Discharge of Condition,WI,Winton,MSAMUTNP06300,M30 8JW
13/63756/DISCON,Land At Deans Field And Moorside Primary And High School Swinton,DISCON,Formal Discharge of Condition,30/08/2013 00:00,"Request for confirmation of compliance of conditions 3 (landscaping and boundary treatment), 6 (off site highway works), 8 (pupils crossing), 17 (community use scheme), 19 (sports hall design), 26 (cycle and refuse areas), 28 (sports pitch lighting)",PDIS,Part Discharge of Condition,19/02/2014 00:00,DISCON,Discharge of Condition,,,MSC2XWNP06300,M30 7LU
13/63760/DISCON,Winton Baptist Church  Parrin Lane Eccles M30 8AY,DISCON,Formal Discharge of Condition,02/09/2013 00:00,"Request for confirmation of compliance of conditions 3, 7, 8, 9  attached to planning permission 13/62846/FUL",PDIS,Part Discharge of Condition,,DISCON,Discharge of Condition,WI,Winton,MSDVJ9NP5Y000,M30 8AZ
13/63792/DISCON,Land Between  Ascension Road And Duke Street Salford M7 1GA,DISCON,Formal Discharge of Condition,04/09/2013 00:00,Request for confirmation of compliance of condition 9 (site investigation) attached to planning permission 12/61819/FUL,DIS,Discharge of Condition,11/09/2013 00:00,DISCON,Discharge of Condition,BR,Broughton,MSV1XZNP06300,M7  1RD
13/63754/DISCON,Land At Fitzwarren Street Salford M6 5RS,DISCON,Formal Discharge of Condition,04/09/2013 00:00,Request for confirmation of compliance of condition 3 (contaminated land) attached to planning permission 10/58982/FUL,DIS,Discharge of Condition,11/09/2013 00:00,DISCON,Discharge of Condition,LG,Langworthy,MSC0TLNP5Y000,M6  5JF
13/63768/DISCON,Unit 151 Ellesmere Shopping Centre Bolton Road Worsley M28 3ZH,DISCON,Formal Discharge of Condition,05/09/2013 00:00,Request for confirmation of compliance of condition 3 (extraction unit) attached to planning permission 13/63392/FUL,DIS,Discharge of Condition,13/09/2013 00:00,DISCON,Discharge of Condition,WN,Walkden North,MSJFH8NP5Y000,M28 3ZD
13/63793/DISCON,St Marks Church Of England Primary School Aviary Road Worsley M28 2WF,DISCON,Formal Discharge of Condition,10/09/2013 00:00,Request for confirmation of compliance of condition 3,DIS,Discharge of Condition,30/09/2013 00:00,DISCON,Discharge of Condition,WO,Worsley,MSV29ANP00B00,M28 2WF
13/63797/DISCON,Units 3 To 4 Washington Centre  100-102 Broadway Broadway Salford,DISCON,Formal Discharge of Condition,10/09/2013 00:00,"Request for confirmation of compliance of conditions 6 (finished floor levels),7 (drainage),10 (construction plan), and 12  (contamination)attached to planning permission 13/63370/FUL",PDIS,Part Discharge of Condition,27/09/2013 00:00,DISCON,Discharge of Condition,,,MSWE9MNP5Y000,M50 2UW
13/63835/DISCON,Peel Park Campus University Of Salford Crescent Salford,DISCON,Formal Discharge of Condition,19/09/2013 00:00,Request for confirmation of compliance of condition 11 (materials) attached to planning permission 13/63457/HYB,,,,DISCON,Discharge of Condition,IW,Irwell Riverside,MTBC2RNP5Y000,M5  4RB
13/63726/DISCON,Chorlton Fold Eccles M30 9NA,DISCON,Formal Discharge of Condition,20/09/2013 00:00,"Request for confirmation of compliance of conditions 3, 5, 6, 7, 8, 9, 11, 12, 13 and 14 attached to planning permission 13/63113/FUL",PDIS,Part Discharge of Condition,,DISCON,Discharge of Condition,EC,Eccles,MRX7JPNP5Y000,M30 9NA
13/63843/DISCON,Land To The West And East Of Junction 11 Of The M60  Eccles Salford,DISCON,Formal Discharge of Condition,24/09/2013 00:00,Request for confirmation of compliance of condition 5 (land contamination) attached to planning permission 12/62500/FUL,DIS,Discharge of Condition,09/12/2013 00:00,DISCON,Discharge of Condition,,,MTD24PNP5Y000,M30 7LU
13/63836/DISCON,Eccles WwTW  Peel Green Road Eccles Salford M30 7DR,DISCON,Formal Discharge of Condition,24/09/2013 00:00,Request for confirmation of compliance of condition 3 (contaminated land) attached to planning permission 12/62462/FUL,PDIS,Part Discharge of Condition,15/11/2013 00:00,DISCON,Discharge of Condition,BA,Barton,MTBC3JNP5Y000,M30 7DR
13/63903/DISCON,Omega Engineering Limited Phase 1 Omega Drive Cadishead M44 5BD,DISCON,Formal Discharge of Condition,27/09/2013 00:00,Request for confirmation of compliance of condtion 3 (Landscaping),NDIS,Not discharging,23/10/2013 00:00,DISCON,Discharge of Condition,CD,Cadishead,MTZGULNP00B00,M44 5BD
13/63906/DISCON,Land At Gerald Road Charlestown Salford,DISCON,Formal Discharge of Condition,30/09/2013 00:00,Request for confirmation of compliance of condition 4 (site investigation) attached to planning permission 09/58040/FUL,DIS,Discharge of Condition,23/10/2013 00:00,DISCON,Discharge of Condition,IW,Irwell Riverside,MU3FAUNP06300,M6  6EQ
13/63904/DISCON,63 Lambton Road Worsley M28 2SU,DISCON,Formal Discharge of Condition,01/10/2013 00:00,"Request for confirmation of compliance of conditions 2,4,5,8,10 attached to planning permission 12/62010/FUL",,,,DISCON,Discharge of Condition,WO,Worsley,MTZIOQNP00B00,M28 2SU
13/63907/DISCON,Wentworth High School Wentworth Road Eccles M30 9BP,DISCON,Formal Discharge of Condition,01/10/2013 00:00,Request for confirmation of compliance of condition 2 (materials) attached to planning permission 13/63065/FUL,DIS,Discharge of Condition,10/10/2013 00:00,DISCON,Discharge of Condition,EC,Eccles,MU3G1INP06300,M30 9BP
13/63909/DISCON,Former Oasis Academy Playing Fields And Muliti Use Games Area Eccles Old Road Salford,DISCON,Formal Discharge of Condition,01/10/2013 00:00,Request for confirmation of compliance of condition 2 (materials) attached to planning permission 13/62681/FUL,DIS,Discharge of Condition,21/11/2013 00:00,DISCON,Discharge of Condition,SW,Weaste  And Seedley,MU3HE2NP06300,M6  8GG
13/63910/DISCON,Former Land Rear Of Manchester Road Wardley Campus Ash Drive Wardley Swinton,DISCON,Formal Discharge of Condition,01/10/2013 00:00,Request for confirmation of compliance of condition 8 (BREEAM) attached to planning permission 10/59642/OUT,DIS,Discharge of Condition,09/10/2013 00:00,DISCON,Discharge of Condition,SN,Swinton North,MU3HZ9NP06300,M27 9QQ
13/63881/DISCON,The New Ellesmere  East Lancashire Road Swinton M27 0AA,DISCON,Formal Discharge of Condition,03/10/2013 00:00,Request for confirmation of compliance of condition 2 (materials) and 8 (sound insultation) attached to planning permission 12/62218/FUL,DIS,Discharge of Condition,08/01/2014 00:00,DISCON,Discharge of Condition,WO,Worsley,MTQ0WXNP5Y000,M27 0AA
13/63874/DISCON,2-3 Mocha Parade Salford M7 1QE,DISCON,Formal Discharge of Condition,07/10/2013 00:00,"Request for confirmation of compliance of conditions 6,20,25,26,27 And 33 attached to planning permission 12/62582/EIAHYB",NDIS,Not discharging,02/01/2014 00:00,DISCON,Discharge of Condition,BR,Broughton,MTO64UNP5Y000,M7  1QA
13/63717/DISCON,Brian Blatchford Building University Of Salford Broad Street Salford,DISCON,Formal Discharge of Condition,09/10/2013 00:00,Request for confirmation of compliance of condition 4 (landscaping) attached to planning permission 13/63181/FUL,,,,DISCON,Discharge of Condition,IW,Irwell Riverside,MRU4LTNP06300,M6  6PU
13/63913/DISCON,Eccles WwTW  Peel Green Rd Peel Green Eccles M30 7DR,DISCON,Formal Discharge of Condition,11/10/2013 00:00,Request for confirmation of compliance of conditions 4 (dust management) and 7 (invasive species) attached to planning permission 12/62462/FUL,PDIS,Part Discharge of Condition,08/11/2013 00:00,DISCON,Discharge of Condition,BA,Barton,MU4U84NP5Y000,M30 7DR
13/63917/DISCON,Land Between Hill Street And Bowker Street Great Cheetham Street West Salford,DISCON,Formal Discharge of Condition,11/10/2013 00:00,"Request for confirmation of compliance of conditions 3, 6, 7, 8, 9, 12 and 15 attached to planning permission 13/63374/FUL",PDIS,Part Discharge of Condition,11/11/2013 00:00,DISCON,Discharge of Condition,BR,Broughton,MU6OUJNP5Y000,M7  2DP
13/63969/DISCON,230- 240 Langworthy Road Salford M6 5WW,DISCON,Formal Discharge of Condition,14/10/2013 00:00,"Request for confirmation of compliance of conditions 4, 5 and 8 attached to planning permission 11/61035/FUL",DIS,Discharge of Condition,21/11/2013 00:00,DISCON,Discharge of Condition,LG,Langworthy,MUUWTENP00300,M6  5WW
13/63948/DISCON,Former Riverside House 1 St Simon Street Salford M3 7ET,DISCON,Formal Discharge of Condition,14/10/2013 00:00,Request for confrimation of compliance of conditions 6 and 7 attached to planning permission 11/60830/FUL,DIS,Discharge of Condition,31/10/2013 00:00,DISCON,Discharge of Condition,IW,Irwell Riverside,MUNYE2NP00300,M3  7ES
13/63944/DISCON,Pembroke Court Swinton M27 4DY,DISCON,Formal Discharge of Condition,15/10/2013 00:00,"Request for confirmation of compliance of conditions 2 (materials), 4 (tree protection) and 5 (landscaping) attached to planning permission 13/62930/FUL",PDIS,Part Discharge of Condition,11/11/2013 00:00,DISCON,Discharge of Condition,PE,Pendlebury,MUJNJYNP5Y000,M27 4DY
13/63952/DISCON,127 Eastham Way Little Hulton M38 9QF,DISCON,Formal Discharge of Condition,15/10/2013 00:00,"Request for confirmation of compliance of conditions 3, 4, 5, 6, 7, 8 and 9 attached to planning permission 13/63470/FUL",PDIS,Part Discharge of Condition,03/02/2014 00:00,DISCON,Discharge of Condition,WN,Walkden North,MUP7KBNP5Y000,M38 9QF
13/63951/DISCON,Kenyon Way Little Hulton (Kenyon Gateway Phase 2),DISCON,Formal Discharge of Condition,17/10/2013 00:00,"Request for confirmation of compliance of conditions 2, 3, 5, 8, 10, 11, 12 and 16 attached to planning permission 13/63301/FUL",PDIS,Part Discharge of Condition,20/01/2014 00:00,DISCON,Discharge of Condition,LH,Little Hulton,MUP7IGNP5Y000,M38 0EN
13/63950/DISCON,Kenyon Way Little Hulton (Kenyon Gateway Phase 1),DISCON,Formal Discharge of Condition,17/10/2013 00:00,"Request for confirmation of compliance of conditions 2, 3, 4, 6, 8, 9 and 12 attached to planning permission 12/63320/FUL",PDIS,Part Discharge of Condition,20/01/2014 00:00,DISCON,Discharge of Condition,LH,Little Hulton,MUP7HYNP5Y000,M38 0EN
13/63863/DISCON,De La Salle Sports And Social Club Lancaster Road Salford M6 8AQ,DISCON,Formal Discharge of Condition,21/10/2013 00:00,Request for confirmation of compliance of conditions 2 (samples) and 5 (site operating statement) attached to planning permission 12/62641/FUL,DIS,Discharge of Condition,20/11/2013 00:00,DISCON,Discharge of Condition,SW,Weaste  And Seedley,MTKQ1VNP06300,M6  8AQ
13/63999/DISCON,Cavendish House 27 Cavendish Road Eccles M30 9JE,DISCON,Formal Discharge of Condition,31/10/2013 00:00,"Request for confirmation of compliance of conditions 1, 2, 4, 5, 6, 7,  8, 9, 10, 11 attached to planning permission 13/62797/FUL",PDIS,Part Discharge of Condition,11/12/2013 00:00,DISCON,Discharge of Condition,EC,Eccles,MVH846NP06300,M30 9JE
13/63972/DISCON,Land At Fairhurst Drive And Aspinall Crescent Salford M28 0JH,DISCON,Formal Discharge of Condition,31/10/2013 00:00,"Request for confirmation of compliance of conditions 2 (coal), 3 (contamination), 4 (drainage), 7 (materials), 8 (finished floor levels), 9 (noise and vibration), 10 (site operating statement), 11 (dust), 13 (biodiversity) attached to planning permission",PDIS,Part Discharge of Condition,30/01/2014 00:00,DISCON,Discharge of Condition,,,MUWM6NNP5Y000,M30 7LU
13/64014/DISCON,The New Ellesmere  East Lancashire Road Swinton M27 0AA,DISCON,Formal Discharge of Condition,01/11/2013 00:00,Request for confirmation of compliance of conditions 6 and 12 attached to planning permission 12/62218/FUL,DIS,Discharge of Condition,24/01/2014 00:00,DISCON,Discharge of Condition,WO,Worsley,MVKRMYNP5Y000,M27 0AA
13/64044/DISCON,Land At Lumns Lane And Agecroft Road Pendlebury Swinton,DISCON,Formal Discharge of Condition,01/11/2013 00:00,Request for confirmation of compliance of conditions attached to planning permission 05/51472/FUL,NDIS,Not discharging,12/02/2014 00:00,DISCON,Discharge of Condition,PE,Pendlebury,MW5RR5NP06300,M27 8WG
13/64049/DISCON,Ellesmere Retail Park Bolton Road Worsley M28 3BT,DISCON,Formal Discharge of Condition,14/11/2013 00:00,"Request for confirmation of compliance of conditions 3, 5, 6, 8, 9, 11, 12, 13, 15, 17 attached to planning permission 13/63208/FUL",PDIS,Part Discharge of Condition,08/01/2014 00:00,DISCON,Discharge of Condition,WN,Walkden North,MW8UC8NP5Y000,M28 3ZD
13/64029/DISCON,50 Cheetham Road Swinton M27 4UQ,DISCON,Formal Discharge of Condition,14/11/2013 00:00,"Request for confirmation of compliance of conditions 2 (materials), 3 (landscape), 4 (contamination), 5 (noise) and 10 (drainage) attached to planning permission 13/63258/FUL",PDIS,Part Discharge of Condition,10/01/2014 00:00,DISCON,Discharge of Condition,SS,Swinton South,MVXQACNP5Y000,M27 4UQ
13/64072/DISCON,Swinton Shopping Centre Swinton M27 4BY,DISCON,Formal Discharge of Condition,18/11/2013 00:00,"Request for confirmation of compliance of conditions 5 - (lighting scheme), 14 - (service yard management plan), 21 - CCTV and security),  26 - (amendments to Wellington Rd landscaping scheme)",DIS,Discharge of Condition,12/12/2013 00:00,DISCON,Discharge of Condition,SS,Swinton South,MWMDQHNP00B00,M27 4BY
13/64053/DISCON,The New Ellesmere  East Lancashire Road Swinton M27 0AA,DISCON,Formal Discharge of Condition,18/11/2013 00:00,Request for confirmation of compliance of conditions 3 (screening fence) and 4 (acoustic barrier) attached to planning permission 13/63270/FUL,DIS,Discharge of Condition,10/01/2014 00:00,DISCON,Discharge of Condition,WO,Worsley,MWCJL7NP5Y000,M27 0AA
13/64079/DISCON,420 Lower Broughton Road Salford M7 2GD,DISCON,Formal Discharge of Condition,19/11/2013 00:00,Request for confirmation of compliance of condition 2 attached to planning permission 13/63471/FUL,DIS,Discharge of Condition,20/01/2014 00:00,DISCON,Discharge of Condition,BR,Broughton,MWNVHTNP06300,M7  2GD
13/64100/DISCON,Former 132 Langworthy Road Salford M6 5PN,DISCON,Formal Discharge of Condition,20/11/2013 00:00,Request for confirmation of compliance of condition 9 (Land Contamination) attached to planning permission 05/51208/FUL,DIS,Discharge of Condition,18/12/2013 00:00,DISCON,Discharge of Condition,LG,Langworthy,MWV98XNP00B00,M6  5LH
13/64099/DISCON,Emmanuel Church Apartments 31 Fir Street Salford M6 5LH,DISCON,Formal Discharge of Condition,20/11/2013 00:00,Request for confirmation of compliance of condition 2 (Land Contamination) attached to planning permission 05/51036/FUL,DIS,Discharge of Condition,18/12/2013 00:00,DISCON,Discharge of Condition,LG,Langworthy,MWV8ZENP00B00,M6  5LH
13/64107/DISCON,35 New Hall Avenue Eccles M30 7LF,DISCON,Formal Discharge of Condition,21/11/2013 00:00,Request for confirmation of condition 2 (Replacement planting scheme),DIS,Discharge of Condition,27/11/2013 00:00,DISCON,Discharge of Condition,BA,Barton,MWVMHMNP00B00,M30 7LF
13/64116/DISCON,L A Pizza Ltd  171 Monton Road Eccles M30 9G,DISCON,Formal Discharge of Condition,26/11/2013 00:00,Request for confirmation of compliance of condition 3 (Air Extraction Equipment) attached to planning permission 13/63719/COU,DIS,Discharge of Condition,13/01/2014 00:00,DISCON,Discharge of Condition,EC,Eccles,MX0WEFNP00B00,M30 9GS
13/64118/DISCON,Schofield And Sons Ltd 259 Monton Road Eccles M30 9PS,DISCON,Formal Discharge of Condition,26/11/2013 00:00,Request for confirmation of compliance of conditions 3 (noise) and 4 (drainage) attached to planning permission 11/60747/FUL,,,,DISCON,Discharge of Condition,EC,Eccles,MX1325NP06300,M30 9PS
13/64074/DISCON,Land To The Rear Of  273-277 Manchester Road East Little Hulton M38 9AW,DISCON,Formal Discharge of Condition,05/12/2013 00:00,Request for confirmation of compliance of conditions 1 - 11 attached to planning permission 12/61481/FUL,PDIS,Part Discharge of Condition,20/12/2013 00:00,DISCON,Discharge of Condition,WS,Walkden South,MWNNLSNP5Y000,M38 9AW
13/64141/DISCON,Milan 17 - 21 Barton Road Worsley M28 2PD,DISCON,Formal Discharge of Condition,06/12/2013 00:00,Request for confirmation of compliance of conditions 1-6 attached to planning permission 13/63829/FUL,DIS,Discharge of Condition,18/12/2013 00:00,DISCON,Discharge of Condition,WO,Worsley,MXBQ8XNP5Y000,M28 2PD
13/64098/DISCON,"Land At Chedworth Crescent, Amblecote Drive West, Amblecote Drive East, Wallbrook Crescent And Land At Kestrel Avenue And Land Adjacent To Falcon Drive Little Hulton Salford",DISCON,Formal Discharge of Condition,06/12/2013 00:00,Request for confirmation of compliance of conditions 8 (noise) and 11 (site investigation) attached to planning permission 12/61940/HYB,PDIS,Part Discharge of Condition,14/02/2014 00:00,DISCON,Discharge of Condition,LH,Little Hulton,MWV29ENP5Y000,M38 9EJ
13/64164/DISCON,Swinton Shopping Centre Swinton M27 4BY,DISCON,Formal Discharge of Condition,06/12/2013 00:00,Request for confirmation of compliance of conditions 23 (Landscaping Scheme),,,,DISCON,Discharge of Condition,SS,Swinton South,MXL784NP00B00,M27 4BY
13/64149/DISCON,Former 272 - 280 Chapel Street Salford M3 5JZ,DISCON,Formal Discharge of Condition,06/12/2013 00:00,Request for confirmation of compliance of conditions 3 (land contam) 4 (drainage) 7 (noise) 10 (samples) attached to planning permission 11/60293/FUL,,,,DISCON,Discharge of Condition,IW,Irwell Riverside,MXE2K8NP06300,M3  5JZ
13/64153/DISCON,"Salford City Council, Halton House  36-38 Eccles Old Road Salford M6 8RA",DISCON,Formal Discharge of Condition,07/12/2013 00:00,"Request for confirmation of compliance of condition 4,6,9, and 10 attached to planning permission 13/63130/FUL",,,,DISCON,Discharge of Condition,LG,Langworthy,MXFFMHNP5Y000,M6  8RA
13/64168/DISCON,Fit City Ordsall Craven Drive Salford M5 3DJ,DISCON,Formal Discharge of Condition,10/12/2013 00:00,"Request for confirmation of compliance of conditions 1,2,3, and 4 attached to planning permission 13/63243/FUL",,,,DISCON,Discharge of Condition,OR,Ordsall,MXLGUQNP00B00,M5  3DJ
13/64170/DISCON,Worsley Old Hall  Walkden Road Worsley M28 2QT,DISCON,Formal Discharge of Condition,11/12/2013 00:00,Request for confirmation of compliance of condition 8,DIS,Discharge of Condition,17/01/2014 00:00,DISCON,Discharge of Condition,WO,Worsley,MXMU9TNP5Y000,M28 2QT
13/64172/DISCON,Land To The Rear Of  41 Great Clowes Street Salford M7 1RQ,DISCON,Formal Discharge of Condition,12/12/2013 00:00,Request for confirmation of compliance of condition 3 (drainage) attached to planning permission 13/63864/FUL,DIS,Discharge of Condition,27/01/2014 00:00,DISCON,Discharge of Condition,BR,Broughton,MXMUAANP5Y000,M7  1RQ
