REFERENCE,LOCATION,APP TYPE,APP TYPE DECODE,VALIDATION DATE,PROPOSAL,RECOMMENDATION,RECOMMENDATION DECODE,DATEDECISS,DEVELOPMENT TYPE,DEVELOPMENT TYPE DECODE,WARD,WARD DECODE,KEYVAL,Postcode
13/63829/FUL,Milan 17 - 21 Barton Road Worsley M28 2PD,FUL,Full application,23/09/2013 00:00,Refurbishment of existing premises with alterations to the front elevations to include replacement of bay windows with folding french doors and a new entrance porch,PER,Approve,08/11/2013 00:00,Q18,Minor Others,WO,Worsley,MT9CYZNP5Y000,M28 2PD
13/63664/FUL,Land Bounded By  Kenyon Way And Parkway Little Hulton Salford,FUL,Full application,24/09/2013 00:00,"Erection of seven dwellings and one convenience store with two apartments at first floor level, together with associated access, parking and landscaping (variation of conditions 2 (materials), 3 (drainage), 4 (remediation works), 6 (landscaping) and 8 (p",PER,Approve,08/01/2014 00:00,Q13,Minor Dwellings,LH,Little Hulton,MRCU5ZNP5Y000,M38 0DH
13/63852/FUL,Arcelormittal Distribution Solutions UK Ltd  Highfield Road Little Hulton M38 9ST,FUL,Full application,25/09/2013 00:00,Demolition of existing two storey extension and erection of a single storey extension,PER,Approve,08/11/2013 00:00,Q18,Minor Others,LH,Little Hulton,MTEWUWNP5Y000,M38 9ST
13/63865/FUL,Food Hall And Market Market Way Salford M6 5HU,FUL,Full application,25/09/2013 00:00,Removal of existing market canopy and retention of replacement canopy,PER,Approve,15/11/2013 00:00,Q18,Minor Others,LG,Langworthy,MTMBI2NP5Y000,M6  5HU
13/63897/FUL,Hoy's Takeaway 98 Liverpool Road Eccles M30 0WZ,FUL,Full application,26/09/2013 00:00,Retrospective application for the erection of a rear lean-to yard canopy extension,PERU,Approve - unconditional,15/11/2013 00:00,Q18,Minor Others,EC,Eccles,MTXSPFNP00300,M30 0WZ
13/63858/FUL,Land Adjacent To 125 Fitzwarren Street Salford M6 5RR,FUL,Full application,26/09/2013 00:00,Erection of three terraced houses,PER,Approve,20/11/2013 00:00,Q13,Minor Dwellings,LG,Langworthy,MTFHCONP00300,M6  5RR
13/63888/FUL,Swinton Park Golf Club East Lancashire Road Swinton M27 5LX,FUL,Full application,26/09/2013 00:00,Erection of a detached building to provide service to golfers.,PER,Approve,19/11/2013 00:00,Q18,Minor Others,SS,Swinton South,MTSGX7NP00300,M27 5LX
13/63455/FUL,Lodge Top Garage Worsley Road North Worsley M28 3GW,FUL,Full application,26/09/2013 00:00,"Change of use of part of land from offices to car sales (sui generis), erection of portacabin, including disabled access ramp, demolition of existing building",PER,Approve,21/11/2013 00:00,Q18,Minor Others,WN,Walkden North,MOYDNVNP06300,M28 3GW
13/63886/FUL,730 Bolton Road Swinton M27 6EW,FUL,Full application,27/09/2013 00:00,Installation of new shop front,PER,Approve,20/11/2013 00:00,Q18,Minor Others,SN,Swinton North,MTRVIMNP5Y000,M27 6EW
13/63893/FUL,544 Liverpool Road Eccles M30 7JA,FUL,Full application,28/09/2013 00:00,Installation of new shop front,PER,Approve,15/11/2013 00:00,Q18,Minor Others,WI,Winton,MTTQ6YNP5Y000,M30 7JA
13/63892/FUL,New Life Church  Liverpool Road Cadishead M44 5AN,FUL,Full application,28/09/2013 00:00,Erection of a single storey rear extension to provide community area.,PER,Approve,20/11/2013 00:00,Q18,Minor Others,CD,Cadishead,MTTQ6SNP5Y000,M44 5AN
13/63869/FUL,293 Liverpool Road Eccles M30 0QN,FUL,Full application,01/10/2013 00:00,Retention of two storey extension with variation of conditions 1 (alterations to the roof shape from a pitched to mono pitch roof) and 2 (white render finish to all elevations) on planning application (11/60816/FUL),PER,Approve,26/11/2013 00:00,Q18,Minor Others,BA,Barton,MTMK3FNP06300,M30 0QN
13/63901/FUL,530 Liverpool Road Eccles M30 7JA,FUL,Full application,01/10/2013 00:00,Installation of new shop front,PER,Approve,21/11/2013 00:00,Q18,Minor Others,WI,Winton,MTZA4WNP5Y000,M30 7JA
13/63864/FUL,Land To The Rear Of  41 Great Clowes Street Salford M7 1RQ,FUL,Full application,02/10/2013 00:00,Creation of a car park and erection of 1.8m access gates/railings,PER,Approve,27/11/2013 00:00,Q18,Minor Others,BR,Broughton,MTMBHONP5Y000,M7  1RQ
13/63879/FUL,Orchard House  318 Ellenbrook Road Worsley M28 1EB,FUL,Full application,03/10/2013 00:00,"Part demolition of the Southern elevation and erection of two storey extension, alterations to elevations and construction of a mezzanine floor to provide an additional storey and creation of 17 no. dwellings (15 townhouses and 2 apartments) together wit",PER,Approve,29/11/2013 00:00,Q07,Small Majors  Dwellings,BE,Boothstown And Ellenbrook,MTQ0VENP5Y000,M28 1EB
13/63821/FUL,The Woodlands Grosvenor Road Swinton M27 5EG,FUL,Full application,03/10/2013 00:00,Creation of a fourth floor to incorporate 3 apartments,REF,Refuse,,Q18,Minor Others,SS,Swinton South,MT2KSXNP06300,M27 5EG
13/63898/FUL,Brotherton House Broadwalk Salford M6 5FX,FUL,Full application,03/10/2013 00:00,"Change of use from library to office and community facilities (B1 / D1), together with alterations to the external elevations",PER,Approve,28/11/2013 00:00,Q18,Minor Others,LG,Langworthy,MTXWB3NP00B00,M6  5UX
13/63912/FUL,3A Egerton Road Worsley M28 3JY,FUL,Full application,04/10/2013 00:00,Demolition of existing house and garage and erection of a new detached dwelling with variation of condition 6 (approved house type) on planning permission 11/60271/FUL,PER,Approve,11/12/2013 00:00,Q13,Minor Dwellings,WN,Walkden North,MU4U7LNP5Y000,M28 3JY
13/63849/FUL,St Pauls Church Manchester Road Worsley M28 3LN,FUL,Full application,07/10/2013 00:00,"Alterations to existing access paths to include raised paths and new steps, together with external amenity and floodlighting",PER,Approve,24/01/2014 00:00,Q18,Minor Others,WN,Walkden North,MTEWTFNP5Y000,M28 3JR
13/63868/FUL,Horseshoe Car Wash  10A Manchester Road West Little Hulton M38 9US,FUL,Full application,08/10/2013 00:00,Retrospective planning application for erection of a canopy,PER,Approve,09/12/2013 00:00,Q18,Minor Others,LH,Little Hulton,MTMBJBNP5Y000,M38 9US
13/63908/FUL,Former Walkden Labour Club 108 Bolton Road Worsley M28 3BW,FUL,Full application,08/10/2013 00:00,"Change of use from Labour Club to A3 restaurant, together with new entrance and canopy and alterations to the elevations",PER,Approve,14/02/2014 00:00,Q18,Minor Others,WN,Walkden North,MU3HDENP00300,M28 3BR
13/63914/FUL,Asda Stores Ltd  604 Bolton Road Swinton M27 4ET,FUL,Full application,09/10/2013 00:00,Continued use of site for retail with the variation of condition 2 (to allow opening hours from 07.00 - 23.00 Monday to Saturday and 10.00 to 18.00 on Sundays) attached to planning permission 12/62286/FUL,PER,Approve,08/01/2014 00:00,Q04,Large Majors Retail distribn servicing,PE,Pendlebury,MU4U8ENP5Y000,M27 4ET
13/63878/FUL,Site Of New Dwelling 248 Leigh Road Worsley,FUL,Full application,09/10/2013 00:00,"Erection of a two storey replacement detached dwelling with realigned access drive, new car parking spaces and associated landscaping",PER,Approve,14/02/2014 00:00,Q18,Minor Others,WO,Worsley,MTQ0T4NP5Y000,M28 1LE
13/63860/FUL,Turnberg Building Level 2 Salford Royal NHS Foundation Trust Stott Lane Salford,FUL,Full application,10/10/2013 00:00,Erection of a new plant room and screening fence and installation of an external staircase to side elevation,PER,Approve,29/11/2013 00:00,Q18,Minor Others,SW,Weaste  And Seedley,MTGRIDNP5Y000,M6  8HZ
13/63911/FUL,St. Thomas of Canterbury RC Primary School  Hadfield Street Salford M7 4XG,FUL,Full application,10/10/2013 00:00,Erection of a single storey infill extension,PER,Approve,20/11/2013 00:00,Q18,Minor Others,BR,Broughton,MU4U5MNP5Y000,M7  4XG
13/63935/FUL,281 Liverpool Road Eccles M30 0QN,FUL,Full application,10/10/2013 00:00,Reroofing and replacement roller shutter door to existing storage unit,PER,Approve,04/12/2013 00:00,Q18,Minor Others,BA,Barton,MUFY7RNP5Y000,M30 0QN
13/63933/FUL,Media City Project Office UK  113 Broadway Salford M50 2EQ,FUL,Full application,10/10/2013 00:00,"Erection of stainless steel ""ribbon"" sculpture and interactive control point (Kiosk)",PER,Approve,27/11/2013 00:00,Q18,Minor Others,OR,Ordsall,MUFY4ZNP5Y000,M50 2EQ
13/63790/FUL,Betfred 64 - 66 Church Street Eccles M30 0DA,FUL,Full application,11/10/2013 00:00,Installation of new shop front,PER,Approve,28/11/2013 00:00,Q18,Minor Others,EC,Eccles,MSUXIFNP06300,M30 0DA
13/63928/FUL,De La Salle Social Club  Lancaster Road Salford M6 8AQ,FUL,Full application,14/10/2013 00:00,Alterations to the elevations and erection of a new brick skin and tiled roof to the existing timber club house (resub of 12/62641/FUL),PER,Approve,29/11/2013 00:00,Q18,Minor Others,SW,Weaste  And Seedley,MUE3I8NP5Y000,M6  8AQ
13/63921/FUL,Holy Cross & All Saints RC Primary School  Trafford Road Eccles M30 0JA,FUL,Full application,14/10/2013 00:00,Erection of a single storey classroom extension,PER,Approve,06/12/2013 00:00,Q18,Minor Others,BA,Barton,MUC8SZNP5Y000,M30 0JA
13/63971/FUL,11 Northumberland Street Salford M7 4RP,FUL,Full application,19/10/2013 00:00,Partial demolition and erection of a two storey rear extension together with 2no. new side access ramps and construction of external staircase (re-sub of 13/63175/FUL),PER,Approve,23/12/2013 00:00,Q18,Minor Others,KR,Kersal,MUWM5ONP5Y000,M7  4RP
12/62633/FUL,1 And 2 Scarr Wheel Salford M7 2FX,FUL,Full application,21/10/2013 00:00,"Change of use from two dwellings into a synagogue and men's mikveh (ritual bath), together with alterations to elevations and car parking",PER,Approve,,Q18,Minor Others,BR,Broughton,MEIFMENP00B00,M7  2FX
13/63941/FUL,Mode Wheel Locks  Broadway Media City Uk Salford M50 2TG,FUL,Full application,21/10/2013 00:00,"Construction of Hydroelectric plant scheme on central ship lock, enabling works to include installation of cofferdams, bracing, and dewatering of small ship lock. Installation of intake screen and channel; fish and eel pass; mechanical turbine and screen",PER,Approve,09/12/2013 00:00,Q18,Minor Others,OR,Ordsall,MUJNIBNP5Y000,M50 2HE
13/63930/FUL,H P L Customer Care  409 Bury New Road Salford M7 4ED,FUL,Full application,23/10/2013 00:00,"Change of use from MOT centre to A1 shop, together with alterations to the front elevations",PER,Approve,17/01/2014 00:00,Q20,Change of Use,BR,Broughton,MUE3IINP5Y000,M7  4ED
13/63973/FUL,Salford Watersports Centre 15 The Quays Salford M50 3SQ,FUL,Full application,24/10/2013 00:00,Replace existing flue dillution with  external vertical flue system,PER,Approve,12/12/2013 00:00,Q18,Minor Others,OR,Ordsall,MUWM6YNP5Y000,M50 3SQ
13/63942/FUL,Land On West Side Of Dale Street Swinton,FUL,Full application,24/10/2013 00:00,Upgrading of Dale Street to include resurfacing and the introduction of footpaths and the erection of six townhouses and two apartments,REF,Refuse,,Q13,Minor Dwellings,WO,Worsley,MUJNIVNP5Y000,M27 0YA
13/63890/FUL,City West Housing Trust 52-56 Regent Street Eccles M30 0AW  M30 0BP,FUL,Full application,25/10/2013 00:00,Demolition of existing housing office and No.54 and 56 and erection of part two/part three storey office building (B1) with variation of conditions 7 and 13 on planning application 12/62481/FUL,PER,Approve,21/01/2014 00:00,Q08,Small Majors Offices R&D light ind,BA,Barton,MTTQ6FNP5Y000,M30 0AW
13/63992/FUL,1 And 2 Scarr Wheel Salford M7 2FX,FUL,Full application,29/10/2013 00:00,Conversion of two bungalows to four ground floor flats including demolition of garage,PER,Approve,,Q13,Minor Dwellings,BR,Broughton,MVDL73NP06300,M7  2FX
13/64001/FUL,"Northern Rail Ltd, Eccles Railway Station  Station Buildings Eccles M30 0DN",FUL,Full application,31/10/2013 00:00,Construction of a new cycle store,WDN,Application Withdrawn,02/12/2013 00:00,Q18,Minor Others,EC,Eccles,MVIWXCNP5Y000,M30 0DN
13/64003/FUL,The Godfather Pizza & Kebab House  185A Liverpool Road Eccles M30 0WD,FUL,Full application,31/10/2013 00:00,Installation of a new shop front,PER,Approve,18/12/2013 00:00,Q18,Minor Others,BA,Barton,MVIWY6NP5Y000,M30 0WD
13/63993/FUL,88 Liverpool Road Irlam M44 6FN,FUL,Full application,04/11/2013 00:00,"Demolition of existing garage, side extension and access stairs and erection of a part two storey / single storey side and rear extension.  Creation of a terraced area and juliet balcony at first floor level to the rear, and alterations to elevations.  C",PER,Approve,,Q18,Minor Others,IR,Irlam,MVDX40NP06300,M44 6FN
13/64009/FUL,10 Kestrel Avenue Clifton Swinton M27 8JL,FUL,Full application,04/11/2013 00:00,Change of use of vacant land to private garden area and erection of a 2m high boundary fence,PER,Approve,06/01/2014 00:00,Q20,Change of Use,PE,Pendlebury,MVJEU1NP06300,M27 8JL
13/64002/FUL,32 Buckingham Road Swinton M27 8QF,FUL,Full application,06/11/2013 00:00,Demolition of existing car port and erection of a single dwelling,PER,Approve,20/12/2013 00:00,Q13,Minor Dwellings,PE,Pendlebury,MVIWXTNP5Y000,M27 8QF
13/63988/FUL,Part First Floor 190 Manchester Road Worsley M28 3LU,FUL,Full application,07/11/2013 00:00,Change of Use of First Floor from Offices (Class B1) to Dance and Fitness Studio (Class D2).,PER,Approve,08/01/2014 00:00,Q20,Change of Use,WN,Walkden North,MV9KTTNP5Y000,M28 3LU
13/64000/FUL,492 Liverpool Road Eccles M30 7HZ,FUL,Full application,12/11/2013 00:00,"Erection of a two storey rear extension, change of use of ground floor to residential use and alterations to elevations",PER,Approve,03/02/2014 00:00,Q18,Minor Others,WI,Winton,MVHCNXNP06300,M30 7HZ
13/63991/FUL,Railway Cutting  Southwest Of Summerfield Road Worsley,FUL,Full application,12/11/2013 00:00,"Erection of control kiosk, pressure relief columns, areas of hardstanding with associated tree removal and creation of temporary access for associated temporary construction compound, with variation of condition 2 (Approved Plans) and condition 9 (Tree R",PER,Approve,21/02/2014 00:00,Q12,Small Majors Others,,,MV9KUANP5Y000,M30 7LU
13/64038/FUL,P B & T Joiners & Builders 405 Liverpool Road Eccles M30 7HB,FUL,Full application,12/11/2013 00:00,Installation of a new shop front,PER,Approve,16/12/2013 00:00,Q18,Minor Others,BA,Barton,MW54XWNP5Y000,M30 7HB
13/64045/FUL,659 Liverpool Road Eccles,FUL,Full application,13/11/2013 00:00,"Change of use of part ground floor from office to residential, internal remodelling and external alterations to facilitate the continued use as 3 self-contained flats Re-sub of 13/63339/FUL",PER,Approve,03/01/2014 00:00,Q18,Minor Others,BA,Barton,MW6ZMLNP5Y000,M30 7BY
13/64061/FUL,Viridor Waste Management Facility Cobden Street Salford M6 6NA,FUL,Full application,15/11/2013 00:00,Erection of a first floor office extension,PER,Approve,20/01/2014 00:00,Q09,Small Majors Gen Ind storage warehouses,IW,Irwell Riverside,MWIMX2NP00300,M6  6NA
13/64059/FUL,732 - 734 Bolton Road Swinton M27 6EW,FUL,Full application,19/11/2013 00:00,Installation of new shop front and alterations to side elevation,WDN,Application Withdrawn,26/11/2013 00:00,Q18,Minor Others,SN,Swinton North,MWI3N0NP5Y000,M27 6EW
13/64069/FUL,494 Liverpool Road Eccles M30 7HZ,FUL,Full application,21/11/2013 00:00,Installation of a new shop front,PER,Approve,06/01/2014 00:00,Q18,Minor Others,WI,Winton,MWLSXGNP5Y000,M30 7HZ
13/64037/FUL,Mees Square Eccles M30 7AF,FUL,Full application,22/11/2013 00:00,"Alterations to external elevations to include over-cladding, glazed enclosures to balconies, new canopy over main entrance, reconstruction of existing ramp. Revised roof top plant area including an ecopod and solar panels    Demolition of existing garage",PER,Approve,17/01/2014 00:00,Q18,Minor Others,BA,Barton,MW54XONP5Y000,M30 7AF
13/64055/FUL,Palmer Demolition Ltd Polygon House  Mode Wheel Road South Salford M50 1DG,FUL,Full application,25/11/2013 00:00,Erection of a single storey rear extension,PER,Approve,10/01/2014 00:00,Q18,Minor Others,SW,Weaste  And Seedley,MWEEA0NP5Y000,M50 1DG
13/64043/FUL,Site Of Former Oakwood High School Park Lane Claremont Salford M6 7RQ,FUL,Full application,27/11/2013 00:00,"Erection of a new primary school, together with associated car parking and external play areas",PER,Approve,07/02/2014 00:00,Q12,Small Majors Others,,,MW5Q6RNP00300,M30 7LU
13/64109/FUL,Market Hall  133 Church Street Eccles M30 0EW,FUL,Full application,27/11/2013 00:00,Installation of new frontage to market hall,PER,Approve,14/02/2014 00:00,Q18,Minor Others,BA,Barton,MWWWX8NP5Y000,M30 0EW
13/64019/FUL,St Ambrose Barlow RC School   Manchester Road  Swinton Wardley  M27 9QL,FUL,Full application,28/11/2013 00:00,Erection of extension to existing school together with associated works,PER,Approve,07/02/2014 00:00,Q12,Small Majors Others,SN,Swinton North,MVS69SNP5Y000,M27 9QP
13/64073/FUL,Lowry Point Service Station 138 Trafford Road Salford M5 3AW,FUL,Full application,28/11/2013 00:00,Alterations to elevations,PER,Approve,10/01/2014 00:00,Q18,Minor Others,OR,Ordsall,MWNNL2NP5Y000,M5  3AW
13/64123/FUL,Windsor Dental Practice Belvedere Road Salford M6 5EQ,FUL,Full application,28/11/2013 00:00,Erection of a single storey rear extension and rear dormer,PER,Approve,12/02/2014 00:00,Q18,Minor Others,LG,Langworthy,MX6CG1NP06300,M6  5EQ
13/64027/FUL,174 Moorside Road Swinton M27 0LE,FUL,Full application,28/11/2013 00:00,Change of use from (A1) shops to (A5) Hot Food Takeaways,PER,Approve,,Q18,Minor Others,SN,Swinton North,MVXQ9PNP5Y000,M27 0LE
13/63994/FUL,Former Royal Manchester Childrens Hospital Hospital Road Pendlebury Swinton,FUL,Full application,28/11/2013 00:00,"Partial re-plan of area within the approved layout on planning permission 11/60016/OUT to replace 13no dwellings with 19no dwellings, including substitution of house type",,,,Q07,Small Majors  Dwellings,CL,Claremont,MVF7MHNP5Y000,M27 4HG
13/64115/FUL,Station House Station Road Irlam M44 5ZR,FUL,Full application,29/11/2013 00:00,"Refurbishment of Station Building to provide offices and waiting area, new verandah, alterations to elevations, demolition of existing lean to and erection of a single storey side extension, change of use of first floor office (B1)  to residential apartm",PER,Approve,,Q18,Minor Others,CD,Cadishead,MX0M9ZNP5Y000,M44 5AB
13/64166/FUL,"Land Bounded By The A580 East Lancashire Road, To The North By The M61 Exit Slip Road Onto The A580, And The West By The M60 On Slip From A580",FUL,Full application,02/12/2013 00:00,Construction of a park and ride service,,,,Q12,Small Majors Others,WS,Walkden South,MXL9D4NP00B00,M28 2DB
13/64094/FUL,Car Park Gore Street Salford,FUL,Full application,02/12/2013 00:00,"Continued use as a public car park, including resurfacing, erection of 1.1m high boundary fencing and three Pay and Display Machines",,,,Q18,Minor Others,OR,Ordsall,MWTRL4NP06300,M3  5EQ
13/64114/FUL,285 Rivington Crescent Pendlebury Swinton M27 8TW,FUL,Full application,04/12/2013 00:00,"Erection of a two storey side extension to create two self-contained flats",REF,Refuse,29/01/2014 00:00,Q13,Minor Dwellings,PE,Pendlebury,MWZ9SHNP00B00,M27 8TW
13/64128/FUL,Flat 175A Monton Road Eccles M30 9GS,FUL,Full application,05/12/2013 00:00,Change of use of first floor from C3 (Residential) to A3 (Food and Drink),PER,Approve,30/01/2014 00:00,Q20,Change of Use,EC,Eccles,MX9VLBNP5Y000,M30 9GS
13/64127/FUL,"Salford Primary Care Trust, The Willows  Lords Avenue Salford M5 5JR",FUL,Full application,05/12/2013 00:00,Demolition of existing parapet wall and coping stone back to roof level and replace existing sheet roofing with insulated roof panels,PER,Approve,30/01/2014 00:00,Q18,Minor Others,SW,Weaste  And Seedley,MX9VKWNP5Y000,M5  5JR
13/64130/FUL,86 Raven Way Salford M6 5HT,FUL,Full application,06/12/2013 00:00,Installation of 5 condenser units,PER,Approve,31/01/2014 00:00,Q18,Minor Others,LG,Langworthy,MX9VLRNP5Y000,M6  5HW
13/64125/FUL,Monton House Hotel  116-118 Monton Road Eccles M30 9HG,FUL,Full application,09/12/2013 00:00,Demolition of existing hotel and erection of a 42 unit retirement complex together with car parking and landscaping (resub of 12/62628/FUL),PER,Approve,,Q12,Small Majors Others,EC,Eccles,MX8131NP5Y000,M30 9HG
13/64108/FUL,7 Manchester Road Worsley M28 3NS,FUL,Full application,12/12/2013 00:00,Change of use from doctors surgery to four self contained units and alterations to elevations,REF,Refuse,,Q18,Minor Others,WS,Walkden South,MWWWWRNP5Y000,M28 3NS
13/64146/FUL,"Salford City College, City Campus  Frederick Road Salford M6 6AP",FUL,Full application,13/12/2013 00:00,Creation of a new stepped access across the existing grass verge,PER,Approve,12/02/2014 00:00,Q18,Minor Others,IW,Irwell Riverside,MXDKYLNP5Y000,M6  6AP
13/64171/FUL,Alliance Consulting Engineers Ltd  59 Regent Street Eccles M30 0BP,FUL,Full application,16/12/2013 00:00,Change of use from A2 (office) to C3 (residential) and alterations to elevations,PER,Approve,03/02/2014 00:00,Q18,Minor Others,EC,Eccles,MXMUA2NP5Y000,M30 0BP
13/64063/FUL,32 Dovedale Avenue Eccles M30 9JA,FUL,Full application,16/12/2013 00:00,Change of use of vacant land to private garden area and erection of 1.8m high fence,PER,Approve,,Q18,Minor Others,EC,Eccles,MWJY95NP5Y000,M30 9JA
13/64193/FUL,28-30 Broom Lane Salford,FUL,Full application,16/12/2013 00:00,Erection of a single storey extension to study hall (resub of 12/62322/FUL),,,,Q18,Minor Others,KR,Kersal,MXYF4UNP06300,M7  4FX
13/64184/FUL,"Greater Manchester Fire & Rescue Service, Eccles Fire Station  288 Liverpool Road Eccles M30 0RZ",FUL,Full application,17/12/2013 00:00,New cladding over existing parapet wall,PER,Approve,10/02/2014 00:00,Q18,Minor Others,BA,Barton,MXXY8UNP5Y000,M30 0RZ
13/64208/FUL,2 Godfrey Road Salford M6 7QP,FUL,Full application,17/12/2013 00:00,"Conversion of ground floor garages, storage rooms and first floor flat to a two storey dwelling",PER,Approve,04/02/2014 00:00,Q13,Minor Dwellings,CL,Claremont,MY1SDNNP00B00,M6  7QP
13/64169/FUL,Ellenbrook Primary School  2 Longwall Avenue Worsley M28 7PS,FUL,Full application,18/12/2013 00:00,Installation of a wall mounted canopy,PER,Approve,11/02/2014 00:00,Q18,Minor Others,BE,Boothstown And Ellenbrook,MXMU8YNP5Y000,M28 7PS
13/64161/FUL,44 Liverpool Road Cadishead M44 5AF,FUL,Full application,19/12/2013 00:00,Change of use from nursery to C3 (dwellinghouse) and alterations to the front elevation,REF,Refuse,10/02/2014 00:00,Q18,Minor Others,CD,Cadishead,MXKZLCNP5Y000,M44 5AF
13/64223/FUL,11A Lancaster Road Salford M6 8AQ,FUL,Full application,20/12/2013 00:00,Proposed single storey front extension and additional room in the roof including 4 No. car parking spaces and installation of an access ramp and steps to the front elevation,,,,Q18,Minor Others,SW,Weaste  And Seedley,MY3OBYNP06300,M6  8AQ
13/64145/FUL,Sindsley Court Moss Lane Wardley Swinton M27 9RL,FUL,Full application,20/12/2013 00:00,"Erection of a single storey side and rear extension, 1st floor extension, together with alterations to elevations, car parking and landscaping works",PER,Approve,14/02/2014 00:00,Q18,Minor Others,SN,Swinton North,MXDKXONP5Y000,M27 9RL
13/64210/FUL,Oaklands Hospital 19 Lancaster Road Salford M6 8AQ,FUL,Full application,20/12/2013 00:00,"Erection of three storey front extension, part two storey part single storey rear extension, single storey side/rear extension, single storey front extension, chiller compound, plant area, extension to outbuilding and new car parking spaces (resubmission",,,,Q18,Minor Others,SW,Weaste  And Seedley,MY1UU2NP06300,M6  8AQ
13/64228/FUL,Swinton Shopping Precinct Swinton M27 4BY,FUL,Full application,21/12/2013 00:00,Landscaping and public realm works to entrance of shopping centre.,PER,Approve,10/02/2014 00:00,Q18,Minor Others,SS,Swinton South,MY5D0HNP5Y000,M27 4BY
13/64185/FUL,St. Lukes RC Primary School  Swinton Park Road Salford M6 7WR,FUL,Full application,23/12/2013 00:00,Demolition of existing building and erection of a two storey extension to provide 8 No. new classrooms,,,,Q18,Minor Others,CL,Claremont,MXXY98NP5Y000,M6  7WR
13/63927/FUL,20 Oaklands Road Salford M7 3PY,FUL,Full application,23/12/2013 00:00,Erection of a single storey house for assisted living,PER,Approve,,Q13,Minor Dwellings,KR,Kersal,MUE3HTNP5Y000,M7  3PY
13/64238/FUL,Virgin Media Technical Site Wardley Industrial Estate Shield Drive Worsley M28 2QB,FUL,Full application,24/12/2013 00:00,Proposed Installation of 4 no. External Air Conditioning Condenser Units & Associated Works to Existing Virgin Media Technical Site,PER,Approve,17/02/2014 00:00,Q18,Minor Others,SN,Swinton North,MYAWZ8NP5Y000,M28 2AA
13/64217/FUL,Hydraulic & Transmission  9 Cannon Street Salford M3 6JH,FUL,Full application,30/12/2013 00:00,Demolition of single storey element and extension of manufacturing area including alterations to abutting roof section.,PER,Approve,14/02/2014 00:00,Q18,Minor Others,IW,Irwell Riverside,MY3IEBNP5Y000,M3  6JH
13/64152/FUL,Jewish Seminary For Girls 28 Singleton Road Salford M7 4WL,FUL,Full application,02/01/2014 00:00,Erection of a four storey building comprising 8 apartments together with associated landscaping and car parking (resub of 13/62917/FUL),PER,Approve,,Q13,Minor Dwellings,KR,Kersal,MXFFLSNP5Y000,M7  4JP
13/64232/FUL,Springfield Farm  Springfield Lane Irlam M44 6NB,FUL,Full application,02/01/2014 00:00,Erection a single storey barn,,,,Q18,Minor Others,IR,Irlam,MY5D1JNP5Y000,M44 6NB
14/64271/FUL,65 Leicester Road Salford M7 4DA,FUL,Full application,02/01/2014 00:00,"Part demolition of existing property, construction of single storey extension to Beis Hamedrash (study and prayer area), first floor extension to original building, and two storey staircase to north wing.",,,,Q18,Minor Others,KR,Kersal,MZ4N0MNP06300,M7  4DA
14/64253/FUL,413 Liverpool Road Eccles M30 7HB,FUL,Full application,07/01/2014 00:00,Installation of a new shop front,PER,Approve,,Q18,Minor Others,BA,Barton,MZ0U9NNP5Y000,M30 7HB
