REFERENCE,LOCATION,APP TYPE,APP TYPE DECODE,VALIDATION DATE,PROPOSAL,RECOMMENDATION,RECOMMENDATION DECODE,DATEDECISS,DEVELOPMENT TYPE,DEVELOPMENT TYPE DECODE,WARD,WARD DECODE,KEYVAL,Postcode
13/64162/HH,8 Durham Road Salford M6 8NN,HH,Householder,11/12/2013 00:00,Demolition of existing detached garage and conservatory and erection of a single storey rear and side extension.,PER,Approve,05/02/2014 00:00,Q21,Householder Developments,CL,Claremont,MXKZLINP5Y000,M6  8NN
13/64192/HH,18 St Georges Crescent Salford M6 8JN,HH,Householder,11/12/2013 00:00,Ground floor single storey side extension comprising garage/workshop and lounge/dining area,PER,Approve,05/02/2014 00:00,Q21,Householder Developments,SW,Weaste  And Seedley,MXY5TUNP06300,M6  8JN
13/64126/HH,1 Stoneyside Grove Worsley M28 3PD,HH,Householder,13/12/2013 00:00,Erection of a single storey rear extension and installation of an access ramp to the front elevation,PER,Approve,08/01/2014 00:00,Q21,Householder Developments,WN,Walkden North,MX814CNP5Y000,M28 3PD
13/64209/HH,16 Blantyre Road Swinton M27 5ER,HH,Householder,17/12/2013 00:00,Demolition of existing conservatory and erection of a single storey side and rear extension and erection of a first floor side and rear extension,PER,Approve,10/02/2014 00:00,Q21,Householder Developments,CL,Claremont,MY1TW5NP06Q00,M27 5ER
13/64113/HH,64 Thorn Road Swinton M27 5QT,HH,Householder,18/12/2013 00:00,Demolition of existing detached garage and rear conservatory and erection of a two storey side extension and single storey rear extension with balcony above,PER,Approve,11/02/2014 00:00,Q21,Householder Developments,SS,Swinton South,MWXJ8WNP06Q00,M27 5QT
13/64224/HH,20 New Hall Avenue Salford M7 4HR,HH,Householder,19/12/2013 00:00,To extend and re-model the existing main roof to provide additional use of space to the existing 2nd floor bedrooms,,,,Q21,Householder Developments,KR,Kersal,MY3R8RNP06300,M7  4HR
13/64203/HH,8 Old Hall Lane Worsley M28 2FG,HH,Householder,19/12/2013 00:00,Erection of a detached garage to the front of No. 8 Old Hall Lane,PER,Approve,,Q21,Householder Developments,WO,Worsley,MY1NM7NP5Y000,M28 2FG
13/63938/HH,13 Whittle Street Worsley M28 3WT,HH,Householder,19/12/2013 00:00,Demolition of outbuildings at rear of house and erection of a single storey extension to form additional bedroom and bathroom.,PER,Approve,03/02/2014 00:00,Q21,Householder Developments,WN,Walkden North,MUHSUKNP5Y000,M28 3WT
13/64206/HH,40 Algernon Road Worsley M28 3RE,HH,Householder,19/12/2013 00:00,Single storey rear/side extension incorporating brick built shower room with duo pitch roof.,PER,Approve,20/01/2014 00:00,Q21,Householder Developments,WN,Walkden North,MY1NN0NP5Y000,M28 3RE
13/64148/HH,14 Leinster Road Swinton M27 5YG,HH,Householder,20/12/2013 00:00,Demolition of existing detached garage and erection of a two storey side and single storey rear extension,PER,Approve,14/02/2014 00:00,Q21,Householder Developments,SS,Swinton South,MXDKZMNP5Y000,M27 5YG
13/64219/HH,5 Turfnell Way Worsley M28 2PZ,HH,Householder,20/12/2013 00:00,"Demolition of existing conservatory and erection of a single storey rear extension, construction of a rear dormer, raising the existing ridge height and alterations to elevations including new front porch",PER,Approve,27/01/2014 00:00,Q21,Householder Developments,WO,Worsley,MY3IEQNP5Y000,M28 2PZ
13/64221/HH,3 Knights Grove Swinton M27 0GL,HH,Householder,20/12/2013 00:00,Erection of a single storey rear extension (resub of 13/63990/HH),PER,Approve,20/01/2014 00:00,Q21,Householder Developments,WO,Worsley,MY3IF3NP5Y000,M27 0GL
13/64229/HH,57 Coronation Street Swinton M27 6DH,HH,Householder,21/12/2013 00:00,Erection of a single storey side extension,PER,Approve,12/02/2014 00:00,Q21,Householder Developments,PE,Pendlebury,MY5D0RNP5Y000,M27 6DH
13/64177/HH,18 Winster Road Eccles M30 7DP,HH,Householder,23/12/2013 00:00,Demolition of existing outbuilding and erection of an attached garage,PER,Approve,14/02/2014 00:00,Q21,Householder Developments,BA,Barton,MXN7K2NP00B00,M30 7DP
13/64220/HH,114 Lancaster Road Salford M6 8AW,HH,Householder,23/12/2013 00:00,Ground floor rear extension to form level access shower facilities,PER,Approve,14/02/2014 00:00,Q21,Householder Developments,SW,Weaste  And Seedley,MY3IEZNP5Y000,M6  8AW
13/64176/HH,14 Victoria Road Eccles M30 9HB,HH,Householder,23/12/2013 00:00,"Erection of a single storey rear extension, garage conversion and two storey side extension",PER,Approve,14/02/2014 00:00,Q21,Householder Developments,EC,Eccles,MXMUBZNP5Y000,M30 9HB
13/64205/HH,181 Greenleach Lane Worsley M28 2RR,HH,Householder,23/12/2013 00:00,Demolition of existing single storey kitchen to rear and construction of new single storey extension to rear,PER,Approve,03/02/2014 00:00,Q21,Householder Developments,WO,Worsley,MY1NMQNP5Y000,M28 2RR
13/64237/HH,3 St. Austells Drive Swinton M27 4JH,HH,Householder,24/12/2013 00:00,Demolition of conservatory and erection of a two storey rear extension.,PER,Approve,17/02/2014 00:00,Q21,Householder Developments,CL,Claremont,MYAWYINP5Y000,M27 4JH
13/64077/HH,Spinney End 77 Lumber Lane Worsley M28 2QN,HH,Householder,25/12/2013 00:00,Construction of a new vehicular access together with new 1.2m high gates and brick wall,,,,Q21,Householder Developments,WO,Worsley,MWNNMZNP5Y000,M28 2QN
13/64187/HH,66 Gorton Street Eccles M30 7EH,HH,Householder,02/01/2014 00:00,Erection of a two storey side extension and single storey front and rear extensions,PER,Approve,,Q21,Householder Developments,WI,Winton,MXXY9MNP5Y000,M30 7EH
13/64136/HH,91 Leicester Road Salford M7 4GG,HH,Householder,02/01/2014 00:00,Erection of a single storey rear extension,PER,Approve,17/02/2014 00:00,Q21,Householder Developments,KR,Kersal,MX9VO2NP5Y000,M7  4GG
14/64262/HH,13 May Road Pendlebury Swinton  M27 5FS,HH,Householder,06/01/2014 00:00,Erection of a first floor side extension.,WDN,Application Withdrawn,18/02/2014 00:00,Q21,Householder Developments,CL,Claremont,MZ31OHNP06Q00,M27 5FS
14/64250/HH,40 Chatsworth Road Eccles M30 9DY,HH,Householder,06/01/2014 00:00,Erection of a single storey side extension,,,,Q21,Householder Developments,EC,Eccles,MYYZL6NP5Y000,M30 9DY
14/64245/HH,79 Ash Drive Wardley Swinton  M27 9RU,HH,Householder,06/01/2014 00:00,"Demolition of existing garage and erection of side and rear extensions, front and rear dormers, loft conversion and associated works.",PER,Approve,31/01/2014 00:00,Q21,Householder Developments,SN,Swinton North,MYRSR3NP06Q00,M27 9RU
14/64273/HH,45 Broadway Worsley M28 7FA,HH,Householder,07/01/2014 00:00,Alter roof to remove hip and build up a brick gable wall. Form roof in roof space with 2 dormers on rear of dwelling.,REF,Refuse,,Q21,Householder Developments,WS,Walkden South,MZ50RONP06300,M28 7FA
13/64241/HH,63 Branksome Drive Salford M6 7PW,HH,Householder,07/01/2014 00:00,Erection of part single part two storey rear extension,PER,Approve,,Q21,Householder Developments,CL,Claremont,MYB7C1NP00B00,M6  7PW
14/64261/HH,38 Beatrice Road Worsley M28 2TN,HH,Householder,08/01/2014 00:00,"Demolition of existing garage and erection of a two storey side, single storey rear extensions and canopy to front elevation",PER,Approve,,Q21,Householder Developments,WO,Worsley,MZ2OXKNP5Y000,M28 2TN
13/64240/HH,30 Old Hall Road Salford M7 4JH,HH,Householder,08/01/2014 00:00,"Erection of front elevation ground and first floor infill extensions, a single storey rear extension, a rear elevation ground floor infill extension, alterations to the roof to include a pitched roof with a Juliet balcony at third floor level, together w",PER,Approve,,Q21,Householder Developments,KR,Kersal,MYAX0DNP5Y000,M7  4JH
14/64269/HH,22 Lambton Road Worsley M28 2ST,HH,Householder,09/01/2014 00:00,Erection of a two storey side and single storey rear extension.,PER,Approve,,Q21,Householder Developments,WO,Worsley,MZ4JNLNP5Y000,M28 2ST
13/64201/HH,108 Claremont Road Salford M6 8NL,HH,Householder,10/01/2014 00:00,Erection of single storey rear extension,PER,Approve,,Q21,Householder Developments,CL,Claremont,MY1NLCNP5Y000,M6  8NL
14/64248/HH,22 Hawthorn Avenue Eccles M30 9JT,HH,Householder,14/01/2014 00:00,Removal of existing kitchen extension and replacement with a larger kitchen extension.,,,,Q21,Householder Developments,EC,Eccles,MYYZKRNP5Y000,M30 9JT
14/64268/HH,9 Curzon Road Salford M7 2EG,HH,Householder,14/01/2014 00:00,Erection of two single storey rear extensions.,,,,Q21,Householder Developments,BR,Broughton,MZ4JN2NP5Y000,M7  2EG
13/64157/HH,62 Eden Vale Worsley M28 1YR,HH,Householder,16/01/2014 00:00,Erection of a two storey side extension,,,,Q21,Householder Developments,BE,Boothstown And Ellenbrook,MXHA9YNP5Y000,M28 1YR
14/64289/HH,10 Bindloss Avenue Eccles M30 0DU,HH,Householder,21/01/2014 00:00,Retrospective planning application for demolition of conservatory and erection of a single storey rear extension.,,,,Q21,Householder Developments,EC,Eccles,MZFUPGNP06Q00,M30 0DU
14/64324/HH,35 Lawefield Crescent Clifton Swinton  M27 6NW,HH,Householder,22/01/2014 00:00,Erection of a two storey side extension.,,,,Q21,Householder Developments,PE,Pendlebury,MZV5ZPNP06Q00,M27 6NW
14/64300/HH,234 Lancaster Road Salford M6 8LZ,HH,Householder,22/01/2014 00:00,Demolition of existing garage and erection of a two storey side extension,,,,Q21,Householder Developments,CL,Claremont,MZI3Y3NP06Q00,M6  8LZ
14/64252/HH,10 Mallowdale Worsley M28 1ZW,HH,Householder,23/01/2014 00:00,Erection of a first floor side extension,,,,Q21,Householder Developments,BE,Boothstown And Ellenbrook,MZ0U97NP5Y000,M28 1ZW
14/64288/HH,5 Wardley Hall Lane Worsley M28 2RL,HH,Householder,24/01/2014 00:00,Erection of a first floor side extension and a single storey rear extension.,,,,Q21,Householder Developments,WO,Worsley,MZFSSPNP06Q00,M28 2RL
14/64325/HH,18 Highbury Avenue Irlam M44 6BT,HH,Householder,27/01/2014 00:00,Erection of a single storey side extension and construction of a front porch,,,,Q21,Householder Developments,IR,Irlam,MZY6AJNP5Y000,M44 6BT
14/64314/HH,2 Dalton Drive Swinton M27 8UB,HH,Householder,27/01/2014 00:00,Erection of a single storey rear extension and two storey side extension (resubmission of 13/63830/HH). Amendments to include installation of two velux windows.  Side windows on the two storey extension to be enlarged.  Bi-fold doors on the rear to be re,,,,Q21,Householder Developments,PE,Pendlebury,MZQRMWNP5Y000,M27 8UB
14/64301/HH,86 Wellington Street East Salford M7 4DW,HH,Householder,28/01/2014 00:00,Erection of a single storey rear extension and construction of front and rear dormers.,,,,Q21,Householder Developments,BR,Broughton,MZJCWVNP5Y000,M7  4DW
14/64308/HH,1A Bindloss Avenue Eccles M30 0DT,HH,Householder,29/01/2014 00:00,Alterations to form new first floor and erection of a single storey rear extension.,,,,Q21,Householder Developments,EC,Eccles,MZL7NINP5Y000,M30 0DT
14/64319/HH,1 Mesne Lea Grove Worsley M28 2QL,HH,Householder,30/01/2014 00:00,Erection of a two storey rear and side extension and single storey rear extension,,,,Q21,Householder Developments,WO,Worsley,MZUGYBNP5Y000,M28 2QL
14/64321/HH,2 Park Road Eccles M30 9JJ,HH,Householder,30/01/2014 00:00,Erection of a single storey side extension,,,,Q21,Householder Developments,EC,Eccles,MZUGZ8NP5Y000,M30 9JJ
14/64336/HH,16 Cartmel Grove Worsley M28 2SF,HH,Householder,31/01/2014 00:00,"Erection of two storey front and rear extensions, including remodelling of existing elevations.",,,,Q21,Householder Developments,WO,Worsley,N03Q8WNP5Y000,M28 2SF
14/64329/HH,307 Great Clowes Street Salford M7 2ER,HH,Householder,03/02/2014 00:00,Single storey rear extension,,,,Q21,Householder Developments,BR,Broughton,MZY6BKNP5Y000,M7  2ER
14/64371/HH,300 Bolton Road Pendlebury Swinton M27 8UY,HH,Householder,03/02/2014 00:00,Erection of a single storey rear extension and extension to existing garage (resub of 13/63979/HH to include pitched roof),,,,Q21,Householder Developments,PE,Pendlebury,N0KVEINP06300,M27 8UY
14/64349/HH,2 Marlow Drive Swinton M27 5GS,HH,Householder,05/02/2014 00:00,Erection of ground and first floor single storey extensions to rear,,,,Q21,Householder Developments,SS,Swinton South,N07G59NP5Y000,M27 5GS
14/64361/HH,37 Oaklands Road Swinton M27 0ED,HH,Householder,05/02/2014 00:00,Proposed two storey side extension,,,,Q21,Householder Developments,WO,Worsley,N0FE99NP00300,M27 0ED
13/64244/HH,17 Old Hall Road Salford M7 4JJ,HH,Householder,05/02/2014 00:00,Erection of a single storey rear extension to form dayroom,,,,Q21,Householder Developments,KR,Kersal,MYGGWPNP5Y000,M7  4JJ
14/64395/HH,39 Trenant Road Salford M6 7ES,HH,Householder,06/02/2014 00:00,Erection of a two storey side and single storey rear extension,,,,Q21,Householder Developments,CL,Claremont,N0S979NP00B00,M6  7ES
14/64366/HH,39 Legh Street Salford M7 4EF,HH,Householder,11/02/2014 00:00,"Erection of a front, side and rear extension.",,,,Q21,Householder Developments,KR,Kersal,N0IJL5NP5Y000,M7  4EF
14/64356/HH,4 Bramley Close Swinton M27 0DR,HH,Householder,13/02/2014 00:00,"Conversion of garage to residential, first floor extension for bedroom and new detached garage.",,,,Q21,Householder Developments,WO,Worsley,N0EU8XNP5Y000,M27 0DR
14/64353/HH,31 Shirley Avenue Swinton M27 4HX,HH,Householder,14/02/2014 00:00,Proposed self contained living area,,,,Q21,Householder Developments,CL,Claremont,N09ABCNP5Y000,M27 4HX
14/64389/HH,6 Dalton Drive Swinton M27 8UB,HH,Householder,20/02/2014 00:00,Erection of a two storey side extension,,,,Q21,Householder Developments,PE,Pendlebury,N0PY8ONP5Y000,M27 8UB
14/64394/HH,28 Moat Hall Avenue Eccles M30 7LR,HH,Householder,20/02/2014 00:00,Erection of a single storey side extension,,,,Q21,Householder Developments,WI,Winton,N0S3KANP00B00,M30 7LR
12/61622/HH,15 Seddon Street Little Hulton M38 9RN,HH,Householder,,Retention of a tree house,WDN,Application Withdrawn,23/04/2012 00:00,,,LH,Little Hulton,M1WFZ8NP00B00,M38 9RN
12/61516/HH,50 Greenleach Lane Worsley M28 2RG,HH,Householder,,Demolition of conservatory and erection of part two storey part first floor rear extension together with construction of a rear basement room and retention of a detached shed,DELETE,Application never validated,05/11/2012 00:00,,,WO,Worsley,M0IHDENP00B00,M28 2RG
12/61313/HH,48 Shelley Road Swinton Manchester M27 0PA,HH,Householder,,Erection of a 2m high boundary fence,DELETE,Application never validated,05/11/2012 00:00,,,SN,Swinton North,LXOE98NP5Y000,M27 0PA
12/62102/HH,1 The Warke Worsley M28 2WX,HH,Householder,,Erection of a single storey rear extension,DELETE,Application never validated,27/07/2012 00:00,,,WO,Worsley,M7PFHQNP5Y000,M28 2WX
12/62237/HH,304 Liverpool Road Cadishead M44 5UG,HH,Householder,,Erection of single storey side and rear extension,DELETE,Application never validated,28/08/2012 00:00,,,CD,Cadishead,M98ZGTNP5Y000,M44 5UG
12/61769/HH,10 Limefield Road Salford M7 4LZ,HH,Householder,,Demolition of existing single storey rear elements and erection of a part single part two storey rear extension,DELETE,Application never validated,20/02/2013 00:00,Q21,Householder Developments,KR,Kersal,M40LE7NP00B00,M7  4LZ
12/62704/HH,16 Tyersall Close Eccles M30 9FS,HH,Householder,,Permitted development application. Removal of existing conservatory for a single storey rear extension,DELETE,Application never validated,03/01/2013 00:00,,,EC,Eccles,MFKU8XNP5Y000,M30 9FS
12/62453/HH,9 Gadwall Close Worsley M28 7AF,HH,Householder,,Erection of a single storey lean-to,DELETE,Application never validated,20/02/2013 00:00,Q21,Householder Developments,BE,Boothstown And Ellenbrook,MC4OU7NP5Y000,M28 7AF
12/62480/HH,50 Merchants Quay Salford M50 3XG,HH,Householder,,Rear balcony,DELETE,Application never validated,20/02/2013 00:00,,,OR,Ordsall,MCFSVPNP5Y000,M50 3XG
13/63343/HH,69 Seddon Street Little Hulton M38 9RL,HH,Householder,,Single / Dual Storey Extension to Facilitate Disabled Provisions,WDN,Application Withdrawn,31/05/2013 00:00,,,LH,Little Hulton,MNLNJ7NP5Y000,M38 9RL
12/62488/HH,25 Welwyn Drive Salford M6 7PR,HH,Householder,,EXTENSION,DELETE,Application never validated,20/02/2013 00:00,,,CL,Claremont,MCPKNHNP00B00,M6  7PR
13/62881/HH,111 Eldon Road Irlam M44 6DF,HH,Householder,,Change of use from garage to dog grooming parlour (sui-generis),WDN,Application Withdrawn,18/02/2013 00:00,Q21,Householder Developments,IR,Irlam,MI7A92NP5Y000,M44 6DF
13/63011/HH,10 Larch Avenue Swinton M27 0DQ,HH,Householder,,Demolition of existing rear extension and erection of a single storey side and rear extension,,,,Q21,Householder Developments,WO,Worsley,MJJFLENP5Y000,M27 0DQ
13/63180/HH,29 Parr Fold Avenue Worsley M28 7HE,HH,Householder,,Construction of a side dormer window and first floor rear window with variation of condition 4 (materials) change of roof materials,DELETE,Application never validated,01/10/2013 00:00,,,WS,Walkden South,MLFVH0NP5Y000,M28 7HE
13/63110/HH,5 Vandyke Avenue Salford M6 8FB,HH,Householder,,Erection of a single storey side extension,DELETE,Application never validated,12/04/2013 00:00,,,SW,Weaste  And Seedley,MKO800NP06300,M6  8FB
13/62876/HH,70 Hopefold Drive Worsley M28 3PW,HH,Householder,,Erection of a single stroey front and rear extension,DELETE,Application never validated,14/03/2013 00:00,,,WS,Walkden South,MI5FLKNP5Y000,M28 3PW
13/63165/HH,46 Northumberland Street Salford M7 4DG,HH,Householder,,Demoliton of existing store room  and erection of a single storey succah to the rear,DELETE,Application never validated,,,,BR,Broughton,MLC64XNP5Y000,M7  4DG
13/63152/HH,Birch Farm Off Twelve Yard Road Irlam M30 7RW,HH,Householder,,Demolition of existing timber barn and erection of new masonry barn,WDN,Application Withdrawn,21/05/2013 00:00,,,IR,Irlam,ML3FDBNP06300,M30 7RW
13/64147/HH,1 Carnarvon Street Salford M7 4QH,HH,Householder,,"Remove garage door, brick up the front to include a window and conversion of garage into a room",,,,,,BR,Broughton,MXDKZDNP5Y000,M7  4AT
13/63975/HH,32 Dovedale Avenue Eccles M30 9JA,HH,Householder,,Change of use of vacant land to private garden area and erection of 1.8m high fence,WDN,Application Withdrawn,22/11/2013 00:00,Q21,Householder Developments,EC,Eccles,MV2652NP5Y000,M30 9JA
13/64155/HH,2 Peel Grove Worsley M28 2JN,HH,Householder,,Erection of a single storey side and rear extension,,,,,,WO,Worsley,MXFFMSNP5Y000,M28 2JN
14/64341/HH,21 Monton Avenue Eccles M30 9HS,HH,Householder,,Alterations to roof inlcuding front and rear dormer for loft conversion and single storey lobby extension to front,,,,,,EC,Eccles,N03QAGNP5Y000,M30 9HS
14/64363/HH,22 Oaklands Road Swinton M27 0ED,HH,Householder,,Erection of a first storey rear extension,WDN,Application Withdrawn,14/02/2014 00:00,Q21,Householder Developments,WO,Worsley,N0GOYENP5Y000,M27 0ED
14/64390/HH,1 Wardley Hall Road Swinton M27 9QE,HH,Householder,,Erection of a 2 storey side extension,,,,Q21,Householder Developments,SN,Swinton North,N0PY8XNP5Y000,M27 9QE
13/64024/HH,39 Radcliffe Park Road Salford M6 7WP,HH,Householder,,Retrospective application for the erection of 1.8m high wall and infill raillings (resub of 12/62670/HH),WDN,Application Withdrawn,22/11/2013 00:00,,,CL,Claremont,MVVVLENP5Y000,M6  7WP
13/64089/HH,62 Barton Road M27 5LP,HH,Householder,,Construction of a dropped kerb,,,,Q21,Householder Developments,SS,Swinton South,MWRCY8NP5Y000,M27 5LP
13/63929/HH,4 Waggoners Court Swinton M27 5WF,HH,Householder,,Erection of a two storey side extension,DELETE,Application never validated,11/11/2013 00:00,,,SS,Swinton South,MUE3IENP5Y000,M27 5WF
13/64198/HH,14 Hazelhurst Fold Worsley M28 2JU,HH,Householder,,"Alterations to existing integral garage to form living accommodation, erection of porch to front elevation and erection of detached garage including alterations to driveway",INV,Application invalid,,Q21,Householder Developments,WO,Worsley,MXZSZENP5Y000,M28 2JU
14/64246/HH,85 Fiddlers Lane Irlam M44 6HN,HH,Householder,,"Erection of a single storey rear extension.",DELETE,Application never validated,05/02/2014 00:00,,,IR,Irlam,MYTFKYNP5Y000,M44 6HN
14/64436/HH,5 Ellesmere Road Eccles M30 9HE,HH,Householder,,"Rear extension consisting of a two storey part and a single storey part to provide a kitchen extension at ground floor, bedroom extension at first floor and a study in the loft space",,,,,,EC,Eccles,N1ABNSNP5Y000,M30 9HE
14/64437/HH,23 Radford Drive Irlam M44 6LA,HH,Householder,,DEMOLISH EXISTING GARAGE AND CONSTRUCT SINGLE STOREY SIDE EXTENSION,,,,,,IR,Irlam,N1ABNZNP5Y000,M44 6LA
14/64440/HH,12 Hope Street Salford M7 2ES,HH,Householder,,Proposed flat roofed dormer loft conversion at the rear of the existing dwelling house.,,,,,,BR,Broughton,N1ABOFNP5Y000,M7  2ES
14/64419/HH,26 Park Road Eccles M30 9JJ,HH,Householder,,Erection of a two storey rear extension,,,,Q21,Householder Developments,EC,Eccles,N12WXGNP5Y000,M30 9JJ
12/61465/HYB,The Soap Works Ordsall Lane Salford M5 3LZ,HYB,Hybrid Application,22/02/2012 00:00,"Full planning permission (in accordance with Class E of Part 3 of the General Permitted Development Order 1995) for the change of use, alteration and extension of former factory buildings to employment (B1 and/or B8); and/or hotel (C1); and/or retail (A1",PER,Approve,26/09/2012 00:00,Q06,Large Majors Others,OR,Ordsall,LZUB18NP00300,M5  3LZ
12/61953/HYBRID,"Land And Property Bounded By Broad Street, Cross Street, M602, Langworthy Road, Liverpool Street, Fitzwarren Street, Heywood Way, Hankinson Way, Nursery Street And Eccles Old Road, Pendleton, Salford",HYB,Hybrid Application,29/06/2012 00:00,"Full planning permission for the refurbishment of 1,253 dwellings; construction of 293 new residential dwellings; creation of new public open space; new and realigned roads, car parking, landscaping and highway works, change of use of a retail unit to a",PER,Approve,29/08/2012 00:00,Q06,Large Majors Others,,,M6IYUHNP01600,M30 7LU
12/61940/HYB,"Land At Chedworth Crescent, Amblecote Drive West, Amblecote Drive East, Wallbrook Crescent And Land At Kestrel Avenue And Land Adjacent To Falcon Drive Little Hulton Salford",HYB,Hybrid Application,09/07/2012 00:00,"Detailed application for the demolition of 1 dwellings and erection of 73 dwellings and 5 bungalows with associated landscaping.  Outline application with all matters reserved for the demolition of 3 dwellings and erection of a maximum 44 dwellings, a ma",PER,Approve,27/11/2012 00:00,Q06,Large Majors Others,LH,Little Hulton,M60BLONP5Y000,M38 9EJ
12/62408/HYB,651 Eccles New Road Salford M50 1BA,HYB,Hybrid Application,01/11/2012 00:00,"Full planning permission for the demolition of the existing building and erection of a single storey building (use classes B1, B2, B8).  Outline application including approval for access, appearance, layout and scale for the erection of three single stor",PER,Approve,26/09/2013 00:00,Q03,Large Majors Gen Ind storage warehouses,SW,Weaste  And Seedley,MBO88PNP06300,M50 1BA
13/63457/HYB,Peel Park Campus University Of Salford Crescent Salford,HYB,Hybrid Application,28/06/2013 00:00,"Demolition of existing buildings and structures and full planning permission for the carrying out public realm improvement works, improvements to existing pedestrian and vehicular accesses, landscaping and internal pedestrian and highway works, and outli",PER,Approve,16/09/2013 00:00,Q06,Large Majors Others,IW,Irwell Riverside,MOZNGUNP5Y000,M5  4RB
12/61349/LBC,Salford Magistrates Court Bexley Square Salford M3 6DJ,LBC,Listed Building Consent,26/01/2012 00:00,Listed Building Consent for the installation of a commemorative plaque,PER,Approve,21/03/2012 00:00,Q23,Listed Building Consent  Alter or Extend,IW,Irwell Riverside,LY8VHJNP00B00,M3  6AY
12/61446/LBC,405-407 Bury New Road Salford M7 2BT,LBC,Listed Building Consent,14/02/2012 00:00,Retrospective Listed Building Consent for internal alterations to include internal doors and stud partitions.,PERU,Approve - unconditional,10/04/2012 00:00,Q23,Listed Building Consent  Alter or Extend,BR,Broughton,LZFX6RNP00B00,M7  2BT
12/61443/LBC,Cathedral House 250 Chapel Street Salford M3 5LE,LBC,Listed Building Consent,15/02/2012 00:00,Listed Building Consent for the demolition of the existing garage and removal of existing boundary wall to plinth level and erection of 1.8m metal railings to match existing,PER,Approve,23/03/2012 00:00,Q23,Listed Building Consent  Alter or Extend,IW,Irwell Riverside,LZFSPSNP06300,M3  5LE
12/61568/LBC,Salford Gallery And Museum Crescent Salford M5 4WU,LBC,Listed Building Consent,27/03/2012 00:00,Listed Building Consent for internal and external alterations including works to windows and lighting and layout to facilitate ancillary uses,PER,Approve,29/06/2012 00:00,Q23,Listed Building Consent  Alter or Extend,IW,Irwell Riverside,M1A0X8NP5Y000,M5  4WU
12/61625/LBC,13 The Crescent Worsley M28 2WY,LBC,Listed Building Consent,16/04/2012 00:00,Listed Building Consent for the erection of a rear garden wall and gate,PER,Approve,08/06/2012 00:00,Q23,Listed Building Consent  Alter or Extend,WO,Worsley,M1Y0U2NP5Y000,M28 2WY
12/61737/LBC,Cab Road Bridge Chapel Street Salford,LBC,Listed Building Consent,04/05/2012 00:00,Listed Building Consent for the partial demolition of Cab Road Bridge (forming part of Stephenson's Bridge),PER,Approve,27/06/2012 00:00,Q23,Listed Building Consent  Alter or Extend,OR,Ordsall,M3HOZZNP5Y000,M3  7WJ
12/61830/LBC,The Coach House  32 Greenleach Lane Worsley M28 2RU,LBC,Listed Building Consent,30/05/2012 00:00,Erection of two single storey rear extensions and alterations to lounge window,PER,Approve,24/07/2012 00:00,Q23,Listed Building Consent  Alter or Extend,WO,Worsley,M4O65INP5Y000,M28 2GL
